,id,Comentário,class1,class2,class3
484,j10tt08,depois não digam que o bozo nunca fez nada kkkkkk,Negativo,Negativo,Positivo
485,j10xzz7,Fala isso não que ela ainda é nova kkkk,Não sei dizer,Não sei dizer,Positivo
486,j11z7y9,Que ***tistreza*** 😭😭😭,Negativo,Negativo,Positivo
487,j18d51v,Desculpe-me por ler esse livro e torná-lo desinteressante para vossa excelência,Não sei dizer,Negativo,Positivo
488,j1aehd8,"Como você vai ter sua existência e humanidade respeitada, se ninguém se importa com você?",Negativo,Negativo,Negativo
489,j1d2iur,Professor de economia falando esquerdista retardado? Deve ser formado na escolinha do Olavo de Carvalho,Negativo,Negativo,Negativo
490,j1iz874,"Mais fácil é, mas querer que alguém melhore na vida é um sinal de afeto. Eu adoraria conhecer alguém que fizesse isso comigo",Positivo,Positivo,Positivo
491,j1jq81i,Então você quer que seja extinto? Que cruel!,Negativo,Negativo,Negativo
492,j1mivos,Cidadão de bem… Deus acima de todos!,Não sei dizer,Negativo,Neutro
493,j1t4foo,"Eu recomendo passar a máquina na zero kkkk Sem brincadeira, uma vez eu passei e nunca mais voltei atrás, só que às vezes tenho a impressão de que as pessoas me olham estranho na rua kkkk",Positivo,Positivo,Positivo
494,j1wtaln,O que esses ar condicionados tão fazendo aí ?,Não sei dizer,Neutro,Neutro
495,j20la2r,"É o que os homens mais fazem, gostam do nosso carinho , companhia, mas se não somos a mulher troféu, só serviremos pra momentos de solidão, carência, infelizmente destroem algo muito valioso que é o sentimento verdadeiro que temos por ele . Depois dizem que são FDP pq Uma mulher zoou ele .",Negativo,Negativo,Negativo
496,j23hare,"não tem nada de errado com sua altura. homem nenhum vai te achar menos atrente por isso, capaz de acontecer o contrário. Trabalha nessa alto estima sua e cuidado pra não deixar essa insegurança boba sua te prejudicar",Positivo,Positivo,Positivo
497,j25amyg,isso me pegou demais hauahauhauahauahahaau eu soltei uma gargalhada muito forte aqui no escritório onde trabalho kkkkkkkkkkkkkkkkkkkk,Positivo,Positivo,Positivo
498,j25g6lx,Certeza é uma coisa muito forte de se dizer quando se fala de renda variável.,Negativo,Negativo,Neutro
499,j2b8akm,SAI DAQUI SAI DAQUI,Negativo,Negativo,Negativo
0,hqsx7sc,Existem agiotas e agiotas. Prefere aquele que te mata ou aquele que vai te desfigurar pra fazer programa na zona?,Negativo,Negativo,Positivo
1,hqtloxr,"Falta de qualquer coisa pra beber e apagar, ou talvez ta solito",Não sei dizer,Não sei dizer,Não sei dizer
2,hqudhyy,"Provar não prova porra nenhuma, no máximo ""sugere""",Neutro,Negativo,Positivo
3,hqx8232,"O povo de São Paulo é assim mesmo. A locomotiva do país, piuí!",Não sei dizer,Positivo,Negativo
4,hr3qsmn,"Não sou viciado, mas as vezes dou uma olhadinha, bem vou fazer um teste se consigo ficar 30 dias sem assistir e sem bater uma .",Neutro,Neutro,Neutro
5,hr4r2h2,"Biologicamente? É um homem.

Mas se quer ser identificado como mulher, não vejo qual é a necessidade de se meter. É só respeitar e acabou.",Positivo,Neutro,Positivo
6,hr7awc4,Estava pensando nisso ontem. Eu acho que o Brasil é um caso único de força comunitária dos países latinos em embate direito com o individualismo propagado pelos EUA,Não sei dizer,Positivo,Negativo
7,hrb0w9a,"Verdade! Renegociar para abaixar os juros é bom. Mas 3% já não tá parecendo muito. Ando vendo galera postando, em grupos de FB, que tão pegando empréstimos a 8% a.m.",Positivo,Neutro,Neutro
8,hrpxzzm,"Mas por outro lado, deve dar um certo alívio né? 
Diversas vezes já fui rotulado como burro pra algumas áreas (tenho uma dificuldade absurda com números), como uma pessoa grossa, rude, incompreensiva e chata. 

Acho que eu ficaria bastante satisfeito se descobrisse que isso tudo se trata de uma condição, e que eu não sou burro, antipático ou coisas assim.",Negativo,Negativo,Positivo
9,hrq08kh,Acho q o melhor é o do pão de açúcar q te dá 1 real por milha,Positivo,Positivo,Positivo
10,hs0l9rc,"A Língua Portuguesa é rica e dinâmica, e mudou várias vezes ao longo do tempo. Mas em todas estas vezes, as mudanças foram NATURAIS e adaptaram-se naturalmente ao comportamento linguístico lusófono.

O que essa turma da lacração tenta fazer hoje é mudar a língua de forma ARTIFICIAL e FORÇADA, por motivos políticos e de subversão moral duvidosa.

Ser contra a linguagem neutra é ser a favor da evolução natural da humanidade.",Positivo,Negativo,Negativo
11,hs49tda,"Sim, começaram com essa palhaçada lá em 2018. Aqui eles colocaram uma bandeira do Brasil.",Negativo,Negativo,Negativo
12,hs6dhrj,"Cadê aquele user que faz uns desenhos de amazofuturismo?

Edit: lembrei é o u/Q1R0Z",Neutro,Neutro,Neutro
13,hs8tuth,Mas essa é a questão. Não adianta você querer manter a amizade e você ser o único que dá esse valor se ela não der valor de volta sacou?,Negativo,Neutro,Neutro
14,hsb2oc8,"Se você faz qualquer coisa que pode prejudicar a criança você pode perder a guarda. Isso não é exclusivo de vacina. E aqui criança SEMPRE toma vacina.

 Você perde um monte de coisa porque não tá pensando no bem coletivo. Se quer viver nessa sociedade vacina vai fazer parte ué. Vá lá fundar o seu ancapistao e vê se dá certo na próxima pandemia.",Negativo,Negativo,Negativo
15,hsdd727,Eren Cuck sem condições.  Desanimei de ver o anime.,Negativo,Negativo,Negativo
16,hshzm8i,Pelo menos o Naruto pode voltar a trabalhar como Hokage se perder a eleição. Diferente de um tal juíz aí que conseguiu se queimar tanto que ninguém respeita mais ele no meio,Negativo,Negativo,Não sei dizer
17,hsj5nn6,"Nem precisa ser academia mano, artes marciais é bem legal, eu fiz boxe por um tempo, é bom pra descontar toda sua raiva no treino. Eu lembro que quando comecei a fazer, meu irmão ficou um pouco intimidado kkk, não sei se seria assim no seu caso.",Positivo,Positivo,Positivo
18,ht4ochc,Inclusive a minha atual namorada fez isso também por causa do covid e covid nem existia ainda pra você ver que vírus danado.,Neutro,Não sei dizer,Neutro
19,htcmmgl,"Na série A os times jogam sozinhos? Que eu saiba tem 22 jogadores em campo, não 11. Todos jogam contra todos, todas as camisas e respectivos patrocinadores aparecem em todas as praças.

Quando você incha o campeonato e divide em dois módulos, está dividindo a exposição dos patrocinadores pela metade e tornando o campeonato mais desinteressante. 50% das torcidas só vai acompanhar 50% do campeonato. É um produto pior em todos os sentidos",Neutro,Negativo,Não sei dizer
20,htfen4k,ônibus  esses que sao controlados pelas mesmas familias ja que molham a mao do governo para sempre serem escolhidas em contratos de 10 a 15 anos de serviço....triste,Negativo,Negativo,Negativo
21,htjyl88,"teria do mesmo jeito, ganharam duas euro seguida",Positivo,Neutro,Não sei dizer
22,htqisnv,Mas aquele polvo da copa de 2010 era praticamente um deus,Positivo,Positivo,Positivo
23,hu4hhhb,Steve Bannon a todo vapor kkkk,Negativo,Positivo,Não sei dizer
24,hukp858,"Esse tipo de gente negou a lógica e entrou na loucura, n dá pra conversar, na conversa vc vai usar oq? Vai usar a lógica para convencer q ela está errada? Mas ela já abandonou a lógica.
Esse povo q acredita em terra plana, anti vacina etc estão em um estado mental q n da mais, e tomara q n percebam isso, pq quando perceberem vão se sentir muito mau e envergonhado por ter defendido ideias tão insanas.",Positivo,Negativo,Negativo
25,huutovu,"Cara, eu nem consegui terminar de ler o post pq me subiu um ódio inexplicável. Eu poderia ficar horas justificando a única solução possível mas você provavelmente já sabe. Termina e ponto final. Chora, grita, rola no chão de tristeza mas termina. Muito melhor chorar por perder o que vc gosta do que por manter o que te faz mal. Ser burro é uma escolha e manter essa relação é burrice da sua parte. Desculpa parecer grosso ou algo do tipo mas infelizmente é o jeito mais fácil de ilustrar isso pra alguém que já fez 2 tópicos aqui e nn percebeu que merece mais do que migalha em uma relação.",Não sei dizer,Negativo,Negativo
26,huy5cww,"Sem ironia, áudio visual não é o cara da escola que liga o projetor pra professora de 170 anos que não sabe conectar um USB e dar click no mouse?",Neutro,Neutro,Positivo
27,huzuuce,"Sério isso? Caralho. Nem quero acreditar, preciso achar pq não é possível que voltamos assim.",Neutro,Negativo,Negativo
28,hvabktt,"Curti muito sua dupla personalidade, hehe.",Não sei dizer,Positivo,Não sei dizer
29,hvpj0p9,"Maioria dos soças que eu conheço são consumistas pra caralho. Vai lá playboyzinho, desbanca o capital usando air force 1 e indo pro lollapalooza.",Negativo,Negativo,Negativo
30,hvy88uo,"Araras só ocorrem naturalmente nas Américas. Isso incluí a América do Sul, América Central e a América do Norte, mais especificamente o México.",Neutro,Neutro,Neutro
31,hvy9ju3,Animo umas collab heim. Faço psy trance. Fazer low bpm é mil vezes mais fácil.,Neutro,Positivo,Positivo
32,hw2lkd7,Toda semana um e esse povo não aprende.,Negativo,Negativo,Negativo
33,hw2pc1v,"Bora trampar então meo (Boça, 2021)",Positivo,Neutro,Não sei dizer
34,hw3he28,"duro que não que tenha percebido, estamos com medo de problema de tireoide ou mesmo cancer",Negativo,Negativo,Negativo
35,hw9vjgy,Próximo cancelamento? Tão tentando cancelar o bicho desde 2017.,Negativo,Negativo,Negativo
36,hwazma3,Custava pesquisar a escrita correta de “light”!? Kkkkkk,Negativo,Negativo,Positivo
37,hwe07fk,"Pô, era oq tinha pra época. É igual falar que o Uruguai não é o primeiro campeão mundial porque outros times não quiseram vir ou pelo formato ser totalmente diferente.


É aquela parada, se fosse pra ser um torneio mundial mesmo, nenhum antes de 2001 iria valer, afinal só tinham dois continentes representados.",Negativo,Neutro,Neutro
38,hwfs5m0,"ADM é foda, não liga para o que falam, toda profissão tem a sua valia, cara não faço adm mas gosto muito de processo de melhoria,é fascinante observar como as pessoas se relacionam com as organizações... Enfim vai lá man a USP tem uma pegada bem multidisciplinar e nada impede vc de começar e mudar depois, segue no seu objetivo se tiver que mudar, mude pela sua experiência (nesse caso).",Positivo,Positivo,Positivo
39,hwo6u5v,VAI SE FODER DUDU. TÁ EM CHOQUE?,Negativo,Negativo,Negativo
40,hwvht33,"Eles não estão bem brigando, brigando né. É mais uma provocação até educada, tipo você tirando uma onda com um amigo de outro time. Se for nesse nível eu acho tranquilo. 
~~Mas apoiar o time azul também é dar muito mole né kkkkkk~~",Positivo,Positivo,Positivo
41,hwzod4d,MANO é impressionante a cara de pau dos dois não conseguiria dormir nem fudendo,Negativo,Negativo,Negativo
42,hx1n0wr,"Velocidade ""real"" da via ou velocidade legal da via? Pois é muito raro alguém estar 10% abaixo da velocidade legal, imagine 50%.",Positivo,Neutro,Neutro
43,hx4nleo,"Carai, nice",Positivo,Positivo,Positivo
44,hxd8vvh,Kkk nunca vai ser,Negativo,Negativo,Não sei dizer
45,hxhy62q,"Galera, criei uma comunidade no banco inter. Quem tiver interesse e tiver mais de 150 mil investidos me avise. As vantagens são taxas melhores em renda fixa e ganhar o cartão Black caso a comunidade atinja 2 milhões investidos.",Neutro,Neutro,Neutro
46,hxlcr8n,Mas não é nft,Negativo,Não sei dizer,Neutro
47,hxnlzb2,Eu participei de várias antologias e possuo dois livros publicados. Vou criar outra conta aqui pra divulgar. Obrigado,Neutro,Positivo,Positivo
48,hxq0fhv,"Então que não cobrem que essas semi-amadoras ganhem o salário do Roberto Carlos. Porque é o que mais fazem pra lacrar ""hur durr Marta ganhou 6 bolas de Ouro e o neymar nenhuma e ganha 30400 vezes mais""",Negativo,Negativo,Não sei dizer
49,hxqsaim,"Bota o Marinho, Burro Sousa",Negativo,Negativo,Negativo
50,hxsakrr,É compreensível.,Positivo,Positivo,Positivo
51,hxu0igf,Uuui Uuui,Neutro,Não sei dizer,Positivo
52,hxu0o97,"RJ cidade, zona sul por 6k? É pouco, pra uma quitinete minúscula.

RJ estado, zona sul ta bom por esse valor, voce consegue viver bem dependendo da cidade.",Não sei dizer,Positivo,Neutro
53,hxvk87n,Você se recusar a ficar com ela é o mínimo. Não merece parabéns por culpa disso não.,Negativo,Negativo,Positivo
54,hxwsp69,"HAHAHAHAHAHAHAHAHAHAHAHAH

Sempre diferenciar sobre qual cabeça vc tá falando, a dica é essa!",Neutro,Neutro,Positivo
55,hy0hmi1,"Pois o argumento inicial foi que a maioria das pessoas tá poco se lixando se tão abortando ou não. Cada minuto que vc tá aqui discutindo tem gente abortando no mundo todo... ninguém tá ligando. A pessoa que tem que ligar é a mãe... não vc, nem eu. Se todo mundo que abomina aborto assim ajudasse crianças carentes, né? Mas a maioria nunca doou um centavo. É só pra fingir que é moral mesmo.",Positivo,Negativo,Negativo
56,hy1xiov,Que foda Man :/,Negativo,Negativo,Negativo
57,hyfdabm,Hola comosta,Não sei dizer,Não sei dizer,Não sei dizer
58,hyi6xmk,"&gt; Que o movimento de Putin para garantir a paz nos territórios ucranianos era ""wonderfull"" e coisa de gênio

Não, não disse nada disso. Viu? É uma merda querer sair defecando opinião por aí sem ler o original. 

Mas não se preocupe, eu te trago o que ele disse:

&gt; Isso é genial. Putin declara uma grande parte da Ucrânia como ""independente"". Eu digo: ""Quanta esperteza"". Taí um cara experiente.

Tá vendo como conseguem manipular a sua opinião facilmente, tirando as coisas do contexto original? Uma ironia colocada fora de contexto acaba virando um elogio. Por isso eu te dou a dica: sempre leia o original, se possível com áudio junto para entender o tom e a ênfase.",Positivo,Positivo,Negativo
59,hyidnol,"Blz, Bruce Lee foi uma lenda absurda, mas tu acha realmente que ele era capaz de pegar mais pesado que FUCKING Ronie Coleman no Squat???? Se sim, tu é um brincalhão do krl",Positivo,Negativo,Negativo
60,hylm4r4,Eu revezava titular e reserva foda-se. Todo mundo descansado,Positivo,Neutro,Positivo
61,hyn7w8r,finalmente um comentário não-burro,Positivo,Positivo,Positivo
62,hynpnjg,"O bom é que a guerra é mundial, tamo suave suavao.",Negativo,Negativo,Positivo
63,hyol0pv,"Eu não teria tirado o Mendy. Cara catou tudo, com certeza isso teria um peso para os batedores do Liverpool.",Negativo,Positivo,Não sei dizer
64,hytl4sc,"Porra, achei que ninguém ia falar do Moovit! Uso já há muitos anos, viajei pra vários estados e ele sempre me ajudou, nunca me meteu em furada. Recomendo pra todo mundo!",Positivo,Positivo,Positivo
65,hz27rhz,"Mas é, procurar os posts dos antivaxx para ver que é tudo biluteteia das ideias esse pessoal",Negativo,Negativo,Não sei dizer
66,hz2hir4,"Você não deu argumento, emitiu uma opinião sem fundamento nenhum, em resposta a um comentário que estava nitidamente zoando. Além de complexado e burro, é teimoso.",Negativo,Negativo,Negativo
67,hz3qwt5,"meu, vcs tem que aprender umas habilidades sociais aí, ñ é possível...",Neutro,Negativo,Negativo
68,hz6l20k,"Absurdo são essas pessoas pois desperdiçam comida. No dia seguinte faço bolinho de arroz, uma delícia! Ou acrescento ervilha, milho, cubinho de presunto, queijo, temperos (e o que mais quiser) e coloco assar. 😋",Positivo,Positivo,Positivo
69,hzey8dn,Como dizia o filósofo píton tudo na vida depende do quanto você quer comer alguém.,Não sei dizer,Positivo,Positivo
70,hzq3f4q,"kkkkkkkkkkkkkkkkkkkkkkkkkkkkkkkkkkkkkkkkkkk 

Não tá atrasado pra tomar sua 4ª dose , não ?!",Negativo,Não sei dizer,Não sei dizer
71,hzzawhh,"""Manifestação"" virou sinônimo de rolê, tirar foto pro insta, beber uma cerva, etc. 

Manifestação de verdade é descobrir como sofrer menos influências do clown world e disseminar essas práticas.",Negativo,Negativo,Negativo
72,i013ifn,"Ou anda pelado e quando o drone aparecer , gira o pirocóptero (fazer a piroca girar igual hélice)",Neutro,Não sei dizer,Não sei dizer
73,i01vk33,Parei de estudar por um ano em 2013. Uma das melhores decisões da minha vida.,Positivo,Positivo,Positivo
74,i061d25,"Pior que o Brasil tem uma bomba relógio para ter um crescimento econômico decente e sustentável.

Afinal a população está envelhecendo, eventualmente a população ativa vai chegar em seu PICO e cair e também a própria população vai encolher, creio que no momento que os dois acontecer vai ser uma tarefa bem díficil ter um crescimento decente.",Negativo,Neutro,Negativo
75,i06qc7j,"Pois é kkkk. Com todo respeito, mas tem alguns professores q são fdp dms, acham q a gente tem fôlego pra tudo isso kkk.

Obrigada! Concordo plenamente kkkk",Negativo,Positivo,Positivo
76,i092l9c,Não sei nem fazer uma dívida dessa.,Positivo,Neutro,Neutro
77,i0a188a,"A zambeli e a campagnolo podem não proteger, mas dá pra passar o tempo 🤷",Neutro,Neutro,Não sei dizer
78,i0aub1n,Mas quem ganha salário mínimo tem carro?,Neutro,Neutro,Neutro
79,i0d0e72,Deveria estar arrependido de ser furry. Escrever é o de menos.,Negativo,Negativo,Negativo
80,i0jo832,Bela faixa,Positivo,Positivo,Positivo
81,i0jpcfe,"Dishonored conheço, os outros jogos sao rpg?",Neutro,Neutro,Neutro
82,i0jr6xz,É só piada mano,Neutro,Neutro,Neutro
83,i0knq4a,A M.I.L.F. Simone Tebet,Não sei dizer,Não sei dizer,Não sei dizer
84,i0n8kcj,"DeTuRpArAm MaRQuEs, SeU Fasciste!!",Negativo,Negativo,Negativo
85,i0phw67,"A ênfase deveria der o ""depende do jeito que ele olha"". De que adianta ele não olhar e ficar desejando sem olhar?
Melhor que ele seja sincero no ato de que achar bonita, o que não é errado. Hipócrita demais quem disser que não acha. Ele pode achar homem bonito tb se a masculinidade dele não se sentir ferida com isso. Errado é comparar, desejar, ficar comentando etc.",Não sei dizer,Neutro,Neutro
86,i0vllvx,Suck me,Negativo,Negativo,Negativo
87,i0yxzpu,foi se o tempo que pré libertadores era baba né? bagulho tá foda [tentando passar pano pra 2019],Positivo,Negativo,Não sei dizer
88,i12qd2g,"To ligado e foi até por isso que fiquei puto, me zeraram com a justificativa que eu estava alavancado e na verdade era a diferença dos emolumentos da B3 que não estavam constando e ficaram negativos.",Não sei dizer,Negativo,Negativo
89,i15vfpb,Nível 4: é um alt do Marcelão,Negativo,Não sei dizer,Não sei dizer
90,i1aytht,o consultor tinha oferecido viagens por custos bem baixos para o exterior,Positivo,Neutro,Positivo
91,i1b7es9,Efeito borboleta,Não sei dizer,Não sei dizer,Não sei dizer
92,i1egrrq,"Bem mais caro que aqui onde eu moro. Comprei frango semana passada a 6,69kg coxa e sobrecoxa",Neutro,Neutro,Negativo
93,i1gyrab,"É a mesma merda mesmo. Tu acha que se a pessoa tivesse dinheiro ou condições de ir no médico ela ia estar reclamando na internet? Se ela está, geralmente é porque ela não sabe como vai fazer para comer se precisar se afastar porque o trabalho não vai deixar ela se afastar na boa, é porque ela não tem quem peça um Uber para ela ou não tem nem dinheiro para o Uber para ela se deslocar, etc. Porque via de regra todo mundo sabe que a melhor coisa é ir no médico e ficar de repousinho mas nem todo mundo PODE fazer isso.",Negativo,Negativo,Não sei dizer
94,i1or573,"Vc não acha alienante esta carreira de rh, em q só preocupam com moldar o candidato pra entrevista?? Do tipo dar sinal de braço só para tirar cnh?

Eu teria vergonha de ganhar dinheiro com isto",Negativo,Negativo,Negativo
95,i1svce4,"Imposto é o maior problema, na maioria das vezes…",Negativo,Negativo,Negativo
96,i1vg8z9,Tenta mijar pra ver se saem bolhas.,Negativo,Não sei dizer,Não sei dizer
97,i1wnzfp,NÃO COMPRE DÓLAR AGORA,Neutro,Não sei dizer,Não sei dizer
98,i1wp1fx,"esse filme é realmente bom, pq aparece umas pessoas que eu até hj me pergunto se são cidadãos comuns, mas eles claramente apoiam as ideias antissemitas",Positivo,Positivo,Positivo
99,i1zcaiw,"O zote foi uma bosta mesmo, mas eu ainda passei mais sufoco na Radiância eu acho (embora um monte de gente parece achar facil a luta).

Não compreendi os downvotes tbm, pra mim parecia obviamente brincadeira, a não ser que tem algo que eu não vi ai",Negativo,Negativo,Não sei dizer
100,i205r70,"Uruguai, Equador e Colômbia são lixos iguais ou piores

esse é o problema",Negativo,Negativo,Negativo
101,i23f1i3,"Cara, quando entrei no mercado de trabalho, descobri que todo mundo (hipérbole) traía. Vi casados, com filhos, grávidas, esposos de grávidas, a porra toda. E trocando de empresa, vi que não tem a ver com renda, todo mundo (hipérbole) trai, e quem não trai, é exceção. E não existe critério, as pessoas sarram com outras mais bonitas ou mais feias, jovens ou velhos, e não é pessoal, só sexo sem propósito mesmo.

Mas a propósito da discussão de traição, o problema é que ponto seria traição. Se seu companheiro transar com outro, você vai ficar puto e terminar o relacionamento. Mas e se ele só ficar olhando fotos online e admirando na mente? E se se masturbar pensando na boa? E se paquera ela conversando mas nunca cederia a algo além disso? São situações complicadas, difíceis de controlar, e difíceis de definir o limite do aceitável.",Neutro,Neutro,Neutro
102,i2hoo06,"Tem salário mínimo sim, doidão.",Positivo,Neutro,Negativo
103,i2ija2f,"Os brasileiros são os mais q tem menos qi, igual agr fiquei com menos qi igual a 0",Negativo,Negativo,Negativo
104,i2j8dtq,"Calma OP nao os massacre com tantas verdades. Realmente cara, ultimamente tem surgido esse monte de post de gente reclamando de quem fala pra procurar tratamento. A real é que todo mundo tem seus próprios b.os pra resolver, aí o cara aparece dizendo que vai se matar as vezes sem dar nenhuma informação específica de nada e quer que a comunidade fique passando a mão na cabeça dele e dizendo como ele é incrível mesmo ele estando numa conta fake criada há 2 dias. Confesso que já me sinto velho por não ter mais paciência com esses jovens egocentricos e edgy, que querem culpar os outros por suas frustrações ('nossa eu sou super gente boa, por que ninguém quer ficar comigo? Mulheres só pensam em aparência mimimimi') preguiça demais.",Não sei dizer,Negativo,Negativo
105,i2kw6c6,"Palmeiras é meu rival, São Paulo é meu inimigo, Santos eu não ligo.",Negativo,Negativo,Negativo
106,i2p7l7n,"Não perderá nada com isso, só ganhará. As redes sociais não contribuem para a saúde mental e física.",Positivo,Positivo,Negativo
107,i2qgdpu,"Lembre-se, se a assombração aparecer em cima de vc, de um tapão na bunda dela",Positivo,Positivo,Positivo
108,i2u5dom,"Taquepariu viu, não entendi foi porra nenhuma kkkkkkkk",Negativo,Negativo,Negativo
109,i2vc5nl,"Cara se você falou para a sua esposa que isso nunca aconteceu e ela diz que você esta mentindo, isso quer dizer que ela acredita mais na amiga dela do que em você que é o MARIDO dela, não há muito o que fazer, a sua parte você fez que foi contar a verdade, agora eu no seu lugar começaria a rever o meu casamento, pois a pessoa que eu escolhi para passar o resto da vida, não consegue acreditar em mim, eu largaria de mão.",Negativo,Negativo,Neutro
110,i35h2t9,"Você tem razão nesse ponto. A maneira como eu escrevo é meio direta e insensível. Mas, concorda comigo que  colocar ""como a maioria dos homens pensam"" é um chute pra lá de longe?

Claro que é meu camarada. Eu, no máximo dos máximos posso responder pelos homens heterossexual, brancos, ficando careca e meigordinho, com mestrado, com experiência de vida internacional, na casa dos 40-45 anos. E nem sei se posso elencar ess público como o que eu posso falar porque, segundo uma informação que eu recebi de uma fonte que não posso abrir aqui, 80% dos homens heteros da minha cidade dão a bunda.  Logo, nem eles eu represento 🤣

Mas tu quer ver uma coisa? Dependendo da história que uma menina nos contasse, na hora eu e tu reconheceriamos ""o padrão "" e poderíamos dizer ""ah, mas tá na cara que ess  aí só quer te comer"" porque nos somos homens e conhecemos os homens e pensamos como eles. Talvez não tenhamos as mesmas atitudes, mas daria pra concluir isso tranquilamente.

Ou não. Aí discordariamos é cada um colocaria sua opinião. Se ela fosse tão boa quanto a sua opinião acima, eu mudaria de lado e me juntaria a ti.

Eu pedi ajuda A TODOS QUE RECLAMARAM. Pra ir lá me ajudar a responder as meninas. Mas preferiram me denunciar pro moderador. 🙄",Negativo,Negativo,Neutro
111,i3a5fy3,"Falou pouco, mas falou bonito!",Positivo,Positivo,Positivo
112,i3mxpl5,Tô ligado... Mas ela me disse que tinha meses que não transava e tal,Neutro,Neutro,Não sei dizer
113,i3pe1bw,"Ai o bozo ganha e voce vai engolir dolar a 10 reais e carne a 300, vai la.",Negativo,Negativo,Negativo
114,i3rrjql,"Só dizer São Paulo, gringo não vai diferenciar uma cidade da outra mesmo...",Neutro,Neutro,Negativo
115,i3u27wg,Seu namorado é um bosta,Negativo,Negativo,Negativo
116,i3wcbko,[Me at now.](https://www.youtube.com/watch?v=jyqi3_DpJUA),Neutro,Neutro,Não sei dizer
117,i437sxn,Assacinin SQUID,Neutro,Não sei dizer,Não sei dizer
118,i43kiid,"Foi só o Churín entrar, cara zikado demais.",Negativo,Negativo,Negativo
119,i475itc,O Brasil finalmente vem crescendo e melhorando muito a cada ano que passa desde 2018 e as mulas esquerdistas não enxergam. Nunca foi tão fácil. #MarretadaNo17,Positivo,Positivo,Negativo
120,i4doc81,"Odeio ser estraga prazeres...  
Isso não vai acontecer...",Negativo,Negativo,Negativo
121,i4hnizn,"Vc pode ser ilustrador freelancer. Ganhar dinheiro na Internet é amplo demais. Eu ganho dinheiro pela Internet, no caso trabalho home office.",Neutro,Positivo,Positivo
