,id,Comentário,class1,class2,class3
475,izk6ir9,"Agora essa Croácia joga um futebol nojentissimo, literalmente inimigos do entreternimento",Negativo,Negativo,Negativo
476,izob9un,"Sem novidades, o TSE vai usar sem dó os poderes absolutos dados pelo STF e vai ser assim o governo transformando o congresso em vaca de presépio.",Negativo,Negativo,Negativo
477,izuxz2e,Imaturidade o nome,Negativo,Negativo,Negativo
478,j03q6gc,"Hubiese sido muy lindo un partido Arg vs. Bra. Si bien siempre hay tendencias, el fútbol es impredecible, y la cabeza te juega mucho a favor y en contra -dicho esto, haberle ganado 3 a 0 a Croacia no significa necesariamente haber podido golear a Brasil. No me imagino un partido con gran diferencia de goles, pero sí con mucho contacto y mucha batalla, nos hubiésemos arrancado los ojos los unos a los otros.",Não sei dizer,Positivo,Não sei dizer
479,j0598ir,"Eu tenho um amigo que começou assim tbm, relacionamento virtual e tals. Quando ele foi viajar pra casa da namorada pela primeira vez, eu até acompanhei ele até o aeroporto, um tempo dps ele mudou de estado, se casou com a mina e hj já é pai. Infelizmente a vez do aeroporto foi a última vez que nos vimos, sinto saudades dele, mas fico feliz que ele encontrou alguém que goste e está feliz. Não sei se essa história vai te servir de inspiração, mas fica aí o relato",Positivo,Positivo,Negativo
480,j0egcum,Kkkk espero que sim!,Positivo,Positivo,Positivo
481,j0le6wr,"*guardinha municipal, certamente não passou no concurso de polícia de verdade mas por estar vestindo uma farda ainda sim acha que é o pica das galáxias.",Negativo,Negativo,Negativo
482,j0ogd2y,"Beleza do lance e para o torcedor médio o que importa é gol, se o goleiro fez 10 defesas muito difíceis, pegou uma nota 10 e um atacante vai lá e faz 2 gols de pênalti, quem que o cara que pouco acompanha vai destacar ? O atacante.
Destacando mais a plasticidade, no geral gols são mais bonitos do que uma atuação impecável de um zagueiro por exemplo",Não sei dizer,Neutro,Neutro
483,j0s5036,"Dale o pé na bunda dela mano,tá sendo trouxa pq quer",Positivo,Negativo,Negativo
484,j0umx0t,"Nem li direito então não sei se é ex ou namorada mas sai dessa! Mentira é 2 vezes no máximo, se a pessoa não sabe controlar o próprio uso de drogas cai fora kk eu mesma sou depressiva e não sou assim, ela é autodestrutiva ao extremo, nem quer se ajudar um pouquinho então cai fora antes que sobre pra vc, vc não tem obrigação nenhuma",Positivo,Negativo,Negativo
485,j140bh9,Tava assistindo os plantões históricos da globo e me emocionei com as homenagens da chapecoense.,Positivo,Positivo,Positivo
486,j18p1iv,"Eu consigo, perco metade do que falam tbm, mas ainda gosto bastante. Por isso, ouço alguns podcasts que só falam merda - posso perder metade do papo, e ainda me divertir.",Neutro,Positivo,Positivo
487,j1i3no5,"Tempos atrás vi uma foto antiga (~1900) e atual dum lugar da zona sul do rio, Urca talvez, não lembro.

A natureza era linda demais. O relevo, a mata atlântica e o mar são uma combinação absurda de bonita. Aí na foto atual tinham uns prédios feios, pintura descascada e com aqueles verdes de limo, sei lá. Na descrição o cara ainda dizia que achava lindo hoje.

O brasileiro é predatório e individualista no geral. Conformista também. Não tem preocupação com o bem comum e acha que as coisas são como são.",Negativo,Negativo,Negativo
488,j1id2qk,Não falaram no artigo.,Negativo,Neutro,Negativo
489,j1jkk21,"Todas as pesquisas mostram que sim. Tem outliers tem nego que é dono de puteiro e ganha 100k por mês, mas uma boa escola e faculdade te garantem um salário bem suficiente pra ser feliz",Positivo,Positivo,Neutro
490,j1k9vwz,"Quando você compra cigarro, você financia a indústria de cigarro.

Quando você compra droga ilícita, financia o tráfico, que recruta crianças-soldado para abusar de sua impunidade da maioridade penal, o resultado disso já sabemos.

Quando você se vicia e começar a se afundar, puxa sua família pra baixo junto (tenho viciado na família, só tem dado prejuízo há mais de 30 anos). 

Hábitos pesados desses são raramente destrutivos apenas ao usuário, se não fossem, não haveria muita discussão.",Negativo,Negativo,Negativo
491,j1nkgt7,Eu tentaria me mudar e recomeçar do zero onde ninguém me conhece,Neutro,Neutro,Positivo
492,j1r7yat,Só vítima nesse lixo,Negativo,Negativo,Negativo
493,j1ra2uh,"Ele tá elogiando o presidente por algo que só caiu porque os GOVERNADORES abaixaram o ICMS doa combustíveis.

Ele tá puxando muito o saco só presidente.
Quem salvou a economia foi Michel Temer, Bolsonaro só piorou o que o temer entregou.",Negativo,Negativo,Não sei dizer
494,j1rdmoe,Na Rússia não pode Sergei.,Neutro,Neutro,Negativo
495,j1re98c,"Moça, cria vergonha na cara e vai procurar um trabalho de gente honesta, você vale menos que uma mosca morta, caralho.",Negativo,Negativo,Negativo
496,j1uj31l,"Os outros países já perceberam que o Bolsonaro tá seguindo a agenda do Trump, inclusive se reunindo com a equipe de campanha dele para traçar novos planos. 

A grande questão é que não vai colar. 

Brasil não tem apoio internacional pra apoiar o golpezinho desse mequetrefe.",Negativo,Negativo,Negativo
497,j1x04s4,Que troço é esse ?,Neutro,Negativo,Negativo
498,j2atpus,e existe familia mais carente que a dele?,Negativo,Negativo,Não sei dizer
499,j2az50p,"Aí spook engris, maifrein",Não sei dizer,Neutro,Não sei dizer
0,hqy3znq,"Cozinho uma vez pra semana toda, passo, 10 minutos no máximo lavando panela.


Você tá mascarando preguiça com utilidade.",Negativo,Negativo,Negativo
1,hr10d91,ele conhece e confia no método científico. é titulado o suficiente pra avaliar credibilidade de pesquisas e bem relacionado o suficiente pra conversar com gente de gabarito muito alto das áreas de conhecimento que você tá cobrando...,Positivo,Positivo,Positivo
2,hr9rsev,"nossa, sinto muito pela experiência, mas que bom que resolveu, espero consegui também.",Positivo,Positivo,Positivo
3,hrndbz8,"Mais uma vez, politica achando que entende o mercado de tecnologia, cultura e informação.

Proibe o livro do Hittler, pronto acabou o nazismo.

Podia proibir chover na praia, ou proibir cachorro de apartamento de latir.",Negativo,Negativo,Neutro
4,hrujqdd,"Viajou. Filho tem que morar com os pais até ter condição financeira de se sustentar sozinho. Não precisa casar pra sair de casa, isso é uma mentalidade muito antiga.",Negativo,Positivo,Neutro
5,hruk0zn,Bah ficou tri! Participo de um grupo de ciclismo que são os Capivaras do Asfalto. Kkk,Positivo,Positivo,Neutro
6,hrwuefy,"Chuva demais mata as plantas, e deixa os animais doentes! Certeza que nenhum nordestino iria querer ver suas plantas apodrecendo e seus animais doentes...",Negativo,Negativo,Negativo
7,hrzgtqx,É o shape do homem médio,Negativo,Neutro,Neutro
8,hs8kl2i,"Realmente, tem que resetar a bios. Segue o que o parceiro acima (ou abaixo, não sei kkkk) falou. Ou melhor ainda, pesquisa como resetar a bios da sua placa mãe, você provavelmente vai encontrar um vídeo no YouTube, daí fica mais fácil. Por fim, quanto a tela azul, a minha sugestão (solução mais fácil) mesmo seria testar em um pendrive bootavel uma distro Linux (não precisa instalar, só rodar no pendrive por um tempo). Se o linux crashar é sinal que é problema de hardware, caso contrário só tem duas opções: o problema é de driver (driver no windows é meio cagado mesmo) ou é no seu HD. Pelo que você relatou imagino que seja a primeira opção",Positivo,Positivo,Neutro
9,hsdwg7i,"Interessante, desde a redemocratização ninguém formado em direito assumiu o poder no Brasil e estamos onde estamos.",Negativo,Neutro,Neutro
10,hsnbdo4,"Kkkkkkk nunca vai existir uma anarquia capitalista, realmente necessita de um Estado mínimo",Negativo,Neutro,Não sei dizer
11,hstl3jf,Entregas Pereira,Neutro,Neutro,Não sei dizer
12,hswierm,"&gt;  O investimento pós informar a taxa já é um avanço, pouco tempo atrás nem isso tinha.

Nossa, não fazia idéia que isto acontecia. 

&gt; Tire seus investimentos de lá. 

Eu tenho investimento na XP, mas quando é algo de curto prazo e reserva de emergência, eu vou no do Santander mesmo pela comodidade e para não perder dinheiro com TED. Mas só nos pós-fixados, nestes a rentabilidade é informada.",Positivo,Neutro,Neutro
13,hsxz5o1,"Tirar um filho é pior do que tirar uma vida

Edit : é ruim em tantos níveis que fica difícil encontrar palavras para dizer o quanto é absurdo dizer que o estado não tem que tirar o filho dos outros para empurrar remédios que só servem para fazer mal",Negativo,Negativo,Negativo
14,ht6nuu3,"&gt; vão continuar exatamente como sempre foram.

Engano seu. Antes você demorava pra ser atendido nos serviços públicos porque tinha fila e demoravam pra atender, agora vão demorar mais pra atender porque vai ficar sem luz, sem água e sem outras condições de atendimento. Não tem serviço eficiente que funcione sem uma estrutura básica. Os órgãos públicos vão ficar literalmente disfuncionais.",Neutro,Negativo,Negativo
15,htk3k1o,"Ninguém cospe, a maioria dos big macs são sem picles e se algum gerente pegar é demissão.",Neutro,Neutro,Não sei dizer
16,htmvl8v,exatamente isso,Neutro,Positivo,Positivo
17,htslgxl,"pergunta seria, seu pai é doente mental? ou vcs moram numa vila de aldeões do século 2?",Negativo,Negativo,Negativo
18,httuace,Tem pai que é cego...,Negativo,Neutro,Neutro
19,hu0p1wz,Belo ê paraíso fiscal,Neutro,Negativo,Negativo
20,hu734qw,que isso cara kkkkkkkkkkk até pra ser do contra tem que ter senso,Negativo,Negativo,Negativo
21,huaz1ck,vc não gosta desse sub pq vc é um verme esquerdista... aqui somos liberais/libertarios/ancaps com orgulho... viva a liberdade do individuo acima de tudo! seu lugar OP é la no outro erre seu merda...,Negativo,Negativo,Negativo
22,hufikaa,"Quando você estabelece que ivermectina é uma religião você sedimenta uma pedra fundamental  na sua igreja de pensamento científico e oferece um modelo de comportamento a ser anulado.

Quem toma vive mais e melhor, quem não toma morre mais e vive pior, mas grita que não ""acredita"" em ivermectina 

Assim estabelece a lealdade de acreditar na vacina acima de todas as coisas e não ser punida por ser uma herege que não guardou seu corpo incólume por um ano inteiro sem tratamento prévio.

Não acredito na vacina porque não acreditam na ivermectina",Negativo,Neutro,Negativo
23,huh4lhb,"Tsc, namoral, 5 min na mão sem perder a amizade?",Negativo,Neutro,Negativo
24,huhwe2w,ISSO GALVAO METE O PAU,Positivo,Positivo,Negativo
25,huioy3x,N sei se BDSM em público é permitido mas fodase é Brasil ent pode tudo desde que n tenha X9 senão pega o álcool e o isqueiro e taca fogo nele.,Negativo,Negativo,Neutro
26,hun8mfn,"Tem um que eu só lembro da ultima cena...

Um casal (acho que estavam de férias), a mulher teve depressão ou alguma coisa assim depois que o filho deles morreu. Ela internamente culpa o marido e sobre o enredo, é a unica coisa lembro.

A cena que eu lembro é no fim quando o marido morre e umas crianças começam a tirar as tripas dele por uma ferida e a imagem vai subindo e apagando... e fim. 

Nunca consegui encontrar o nome.",Neutro,Neutro,Neutro
27,hunzs2b,"Está muito descontetualizado mesmo. Quem vendia Negros na costa da África eram os príncipes vencedores negros da África.

E se não me engano ela também fala da escravidão no oriente e oriente médio. 

Você não tem ideia de como o RACISMO no oriente é físico e mentalmente brutal.

No Brasil nos tivemos a mistura de casta. Na Ásia os negros eram vendidos sem pênis e os reprodutores era guardados como gado.

Esse pessoal fala muito em genocídio mas esquece dos escravos Negros mortos aos milhares no oriente médio.

Felipe Neto é um bosta que dispediça ar e espaço no universo.",Negativo,Negativo,Negativo
28,huprvaa,"Se tá com receio de ser algo ruim marca de sair com eles, pranum lugar público tipo shopping e tal, ou barzinho, quando se sentir seguro SENTA A MADEIRA NESSA SAFADA",Não sei dizer,Não sei dizer,Neutro
29,huq62j6,"Faz a rua bem feita: uma oportunidade pra roubar.

Faz a rua mal feita: uma oportunidade pra roubar no início e diversas outras pra recapear o asfalto.",Negativo,Negativo,Negativo
30,husu5c9,"Eu só tenho vontade de destrocar ele, são coisas horríveis que pra mim como pessoa não consigo conviver.",Negativo,Negativo,Negativo
31,huvrw86,"Será que esse pessoal que chama os americanos de ""estadunidense"" sabe que o nome oficial do Brasil foi Estados Unidos do Brasil por quase 80 anos?",Negativo,Neutro,Negativo
32,huyyudz,Sim eu estou apaixonado por umas 3 pessoas e descobri que em uma delas é correspondido. Infelizmente eu não posso falar pra outra pessoa que eu sinto o mesmo por ela kkkkkkkk,Positivo,Neutro,Positivo
33,hv1gzfz,"Ei, mais respeito, não um simples macaco, um macaco da bola azul. Olha lá ein. Kkkkkkk. Poxa cara, que legal que você é um bom cidadão, honesto e blá blá blá blá. Infelizmente não tenho aqui um balão pra te premiar por isso, vou ficar em falta contigo hoje. Me perdoe. E quanto a sapatear no caixão do ""professor"", te digo que adoraria ter tido a oportunidade. Infelizmente não tive...",Neutro,Neutro,Negativo
34,hv4tojl,É tipo fazer piada com povo da APAE. Você xinga pessoas agindo feito retardados de retardados. Agora não se xinga retardados agindo como retardados de retardados. É algo que não se faz.,Não sei dizer,Negativo,Negativo
35,hvamtgu,O monark é brabo.,Positivo,Negativo,Neutro
36,hw8we2g,"Não ia cair fora? KKKKKKKKKK

E outra, quero saber onde eu tô criando essa narrativa sendo que ele fala NO VÍDEO que defende a existência de um partido nazista para o nazista.",Negativo,Negativo,Negativo
37,hwf7qvv,"“Nos salvar” ele quis dizer a reeleição dele? 

Vai o que, tomar outra facada?",Negativo,Negativo,Negativo
38,hwhxvhn,Qual estado? Minha mãe deu aula 30 anos em escola pública aq em SP e era tudo uma mixaria. Good job tucanistão 10/10.,Negativo,Negativo,Neutro
39,hwki7ni,"Eu tinha quase mesmo problema a uns 10 anos atrás. Funcionou pra mim? Sim.

Tu precisa tomar muito cuidado para não ficar gastando grana com isso e não ter mais nenhum problema psicológico ou ainda, ficar pagando garota de programa como desculpa para alguma coisa.

Enfim, a questão psicológica por trás de pagar uma garota de programa, é:

* Saber que mulher é igual a qualquer outra pessoa e que você não deve ficar se apaixonando igual a um retardado por toda e qualquer mulher que você acabou de conversar e não conhece nem 5% da vida dela - Deixe pra se sentir assim quando você conhecer **muito bem uma mulher e que tenha reciprocidade por parte dela.**",Não sei dizer,Negativo,Não sei dizer
40,hwpjfxh,Simplesmente o carrasco dos orelhudo do entretenimento,Positivo,Negativo,Negativo
41,hwrrq3e,Metade ai é tudo vagabundo (conheço gente que tem contato com um dos vices ai),Negativo,Negativo,Negativo
42,hwuctew,"Cara, que sistema tributário maluco tem o brasil para o cidadão médio. Você paga Imposto de renda, que é fácil, e as coisas aumentam mais pelo LUCRO BRASIL (dono repassando todo quanto é aumento e transnacional cobrando em dólar) do que o custo brasil.",Negativo,Negativo,Negativo
43,hwxviqv,"se for, o pai da minha mãe era calvo tbm kkkkkk só piora",Negativo,Negativo,Neutro
44,hx3hig5,"na real o ""ban eterno de 30 dias"" já era uma piadinha antes do facebook existir",Neutro,Neutro,Neutro
45,hxbicl1,"O texto não é assinado por colunistas do UOL. Ademais, em quem confiar? No Constantino, ou no Terça Livre?",Negativo,Negativo,Não sei dizer
46,hxde07b,"É foda véi. Não sei se houve omissão, mas com certeza o poder público não tá preparado para esse tipo de coisa.

Bagulho triste da porra.",Negativo,Negativo,Negativo
47,hxdp4kr,"O Geddel, repito: o GEDDEL, chamando alguém de picareta…",Negativo,Negativo,Negativo
48,hxjng3d,Denuncia pro conselho tutelar,Negativo,Neutro,Neutro
49,hxkuzpc,"Na verdade o AdSense já não paga o que paga a antes, então a não ser que seus vídeos estourem MUITO, o grosso do dinheiro é patreon/patrocínio",Negativo,Negativo,Negativo
50,hxuwtv7,Vc pode trocar o nome do dispositivo e deixar sua mãe chamando a echo de Andresa feliz da vida.,Positivo,Neutro,Não sei dizer
51,hxvol8v,"Cara, eu sou um feliz comprador de um cativeiro gourmet e olha, é complicado hahahahah a arte do desapego é muito forte. É bom pela liberdade de ser jovem mas é apertado, eu que tinha morado em casa a vida toda sinto muito essa diferença e ainda não acostumei, inclusive juntando dinheiro pra tentar comprar uma casa.

O prédio que eu comprei foi todo vendido antes de terminar a construção. Hoje tem aps de 20m² sendo alugado por ~1500 e muita gente que comprou fez isso sabendo que ia alugar rápido.",Positivo,Neutro,Neutro
52,hy13hrd,Todos os brasileiros com grana vão aproveitar essa sandice,Negativo,Negativo,Negativo
53,hy1pnyb,"Dnd, é que depende mt da frequência que esses pensamentos ocorrem.",Neutro,Neutro,Neutro
54,hy32w97,"Que palavras escrotas, parabéns

acordou mal, né",Negativo,Neutro,Negativo
55,hy4k6ly,"Carai, bicho, a galera desse sub tem um tesão inexplicável no Mauro Sérgio",Negativo,Não sei dizer,Negativo
56,hy5jm05,"Que conste que o Atlético tbm tem jogado uma bolinha bem porca a temporada inteira, inclusive hoje. Jogo feio da porra",Negativo,Negativo,Negativo
57,hyla4bj," Cancelar não cancelou, mas ta fazendo corpo mole, inclusive exonerando os servidores envolvidos no processo que trabalham de verdade.
 
 E a Interpol ta bem lerda pra lidar com ele.",Negativo,Negativo,Não sei dizer
58,hysm2wx,"Concordo, mas o que mais se vê é valorização dos terrenos próximos dessas linhas de transporte público se valorizando, e atraindo construções de padrão elevado, o que vai contra o uso popular desse transporte coletivo.",Negativo,Negativo,Positivo
59,hyuechh,"Sim, totalmente. Por isso, acabei não falando nada. Mas gostaria de poder ter falado, só que ninguém compreenderia mesmo.",Neutro,Negativo,Negativo
60,hywohwp,eu acho bom que o brasil fique neutro .,Positivo,Positivo,Não sei dizer
61,hz5axg8,"mano ... os russos abriram fogo e isso é factual.  Era um destroyer contra 13 infantes. Se os caras foram capturados depois .. foda-se.   
É tipo você mandar um foda-se para um tanque só para ter certeza que ele vai atirar. Se você ainda acha eles covardes, blz.",Negativo,Negativo,Negativo
62,hz7eknm,"Vá se foder, fez comentário de bunda, já sei que gosta e quer chupar o bolso",Negativo,Negativo,Negativo
63,hzdjw7f,"agora moro perdeu o chão, o maluco proibiu o vírus, Moro perdeu seu plano de governo",Negativo,Negativo,Negativo
64,hzetj6u,Tais ficando famoso: Newman LM (@LiberdadeNewman) tweetou: Os liberais já estão desistindo https://t.co/jlLKufw8kH https://twitter.com/LiberdadeNewman/status/1499957500195614721?s=20&amp;t=dqU_foT-t4Ho1shwwWcdVw,Não sei dizer,Positivo,Não sei dizer
65,hzgy6wm,Persegue? Pq se não baita mira o cara tem que ter.,Não sei dizer,Não sei dizer,Não sei dizer
66,i0dvtlq,"Po, ainda de Augusto dos Anjos tem uns tão bom quanto, tais como: a obsessão do sangue; versos íntimos; soneto do nascimento; o solitário

Nesse estilo, autores como Álvares de Azevedo, Cruz e Sousa e Charles Baudelaire, por exemplo, são tão bons quanto. O meu poema preferido de todas as épocas é o ""meu sonho"", de Álvares de Azevedo.

Faz um tempinho que não leio poemas, mas tenho planos de voltar a ler, e qualquer coisa tento voltar aqui para compartilhar algo :\^)",Positivo,Positivo,Positivo
67,i0hmwdh,Todos eles mentem e matam amigo... todos eles.,Negativo,Negativo,Negativo
68,i0iu3xn,"O que voce faria se quisesse achar um bom profissional de vdd? meu maior receio sobre isso é achar alguem bom, os profissionais mais velhos com experiencia podem estar desatualizados e sao mais caros, mas os mais jovens nao parecem realmente saber o que estao fazendo. Pergunto pq queria tentar no futuro, pra mim no momento qualquer coisa seria caro demais de qlqr jeito.",Positivo,Neutro,Neutro
69,i0jekwt,+++ O PIOR FOI ELE ME PAQUERANDO DEPOIS,Negativo,Negativo,Negativo
70,i0kprk0,Nunca suspeitaria que ele é o usuário de stand!,Negativo,Positivo,Negativo
71,i0mv2im,"Marco Feliciano é o lixo dos lixos. Começou a vida como pastor de igreja neopetencostal e de lá foi direto para a politica, entupindo os bolsos de dinheiro. 

Se houver um inferno, ele vai direto pra lá.",Negativo,Negativo,Negativo
72,i0rsuq8,jamais sapecarão!!!,Não sei dizer,Não sei dizer,Não sei dizer
73,i0v9s2l,"Lidar com pedreiros é tipo abrir a caixa de Pandora. Acho que o melhor modo de lidar disso é contratando uma empreiteira, porém ficaria um pouco mais caro.",Negativo,Neutro,Neutro
74,i0x0o4b,"Que coisa ridícula, não tem nem internet nem sinal de celular na maioria dos locais de conflito",Negativo,Negativo,Negativo
75,i0x8yn2,"Nisso os EUA estão certos, não tem como manter funcionário público ganhando mais do que na iniciativa privada não. É impossível pra qualquer governo.",Neutro,Neutro,Não sei dizer
76,i18p6qg,"Doente, tem que ir se trata.",Negativo,Positivo,Negativo
77,i1cemc6,"Fato, fizeram uma espinha dorsal com umas liderança bosta em 2017, os caras fracassaram em tudo e tão ai sendo tratados como heróis 

Em 2007 fizemos uma limpa de um time campeão mundial, chutaram fora até o Iarley daquela forma patética. Em 2008 já voltamos a ser competitivos",Negativo,Neutro,Negativo
78,i1ekpw4,você sofreu algum tipo de trauma ou seus pais repreendiam muito o choro na infância?,Não sei dizer,Negativo,Negativo
79,i1f7z02,Ainda melhor que a mentalidade e a história da Mackenzie,Não sei dizer,Não sei dizer,Não sei dizer
80,i1h2wxb,"1 - Entendo, mas na pelada do fds quem escolher o Goretzka antes do Pogba já pode ser internado compulsoriamente

2 - Concordo demais, inclusive, acho o Kante supervalorizado, o Casemiro é melhor que ele e o Kimmich é craque

3 - Ja aceitamos isso como verdade nesse post

4 - Concordo só no comportamento da arquibancada, mas pra mim a perpetuação de uma torcida massiva fora do RJ que nunca viu um jogo do time dentro do estádio exige uma fidelidade e paixão muito maior do que apenas cantar 90min num jogo",Neutro,Neutro,Não sei dizer
81,i1ho6af,"**Fascism () is a form of far-right, authoritarian ultranationalism characterized by dictatorial power, forcible suppression of opposition, and strong regimentation of society and the economy that rose to prominence in early 20th-century Europe. The first fascist movements emerged in Italy during World War I, before spreading to other European countries.**

More details here: &lt;https://en.wikipedia.org/wiki/Fascism&gt; 



*This comment was left automatically (by a bot). If I don't get this right, don't get mad at me, I'm still learning!*

[^(opt out)](https://www.reddit.com/r/wikipedia_answer_bot/comments/ozztfy/post_for_opting_out/) ^(|) [^(delete)](https://www.reddit.com/r/wikipedia_answer_bot/comments/q79g2t/delete_feature_added/) ^(|) [^(report/suggest)](https://www.reddit.com/r/wikipedia_answer_bot) ^(|) [^(GitHub)](https://github.com/TheBugYouCantFix/wiki-reddit-bot)",Neutro,Neutro,Neutro
82,i1iuuw5,"Até o pessoal de hoje aprender a tocar a bola de 1950 eles também passariam aperto. Essas são comparações sem sentido mesmo, até porque o pessoal da época se viesse pra nossa poderia usar a evolução da medicina e não jogaria 200 jogos por ano sem cartões.",Negativo,Neutro,Negativo
83,i1me4g6,só torcedor do flumINSS pode contestar o abel do palmeiras.,Positivo,Negativo,Negativo
84,i1n723d,Mamãe engordei,Negativo,Neutro,Não sei dizer
85,i1obmia,Chique E confortável,Positivo,Positivo,Neutro
86,i1pxned,é mais fácil eles ganharem de 1x0 aos 82' com uma espalmada pra frente do alisson,Negativo,Positivo,Negativo
87,i1r4qjd,"tu ta numa festa, tem um grupo de amigas, vc vai chegar na mais feia? Não, tu chega na que mais te agrada... a não ser q vc tenha uma auto-estima de merda e acredite que não tem chance nenhuma cm as outras... mas ai se for o caso, é melhor vc nem tentar chegar em uma mulher nenhuma na festa, pq tu vai 100% ouvir um não... vai pro tinder q é mais sucesso",Neutro,Neutro,Neutro
88,i1t75x7,"tirar 10 é a ""obrigação"" de todo aluno, qualquer nota abaixo disso é medíocre, seguindo esse pensamento faz de vc só um puto q n apoia ou encoraja a pessoa, se soubesse q tirando 5 na escola eu iria pro mesmo lugar tirando 10, eu teria me esforçado muito menos",Negativo,Negativo,Negativo
89,i2274qu,Certifique-se de que seu coração tá ok também,Positivo,Positivo,Positivo
90,i26lrsy,"Comentario lindissimo. Mais preciso impossivel.
Mas uma duvida: e se o flow desde o começo tivesse peitado o youtube e ido pra outra plataforma de streaming? O publico certamente iria acompanhar..",Neutro,Positivo,Positivo
91,i280fbu,"Desconta fazendo flexão ou abdominal, plmns vai te acalmar creio eu...",Negativo,Positivo,Negativo
92,i2gnet2,"&gt;Se fosse qualquer marido dando o tapa eu ia bater palmas mas como foi esse corno manso eu fiquei é puto.

exatamente",Negativo,Negativo,Negativo
93,i2iqj62,"Faremos uma revolução, o Nick de bot será o novo normal.",Neutro,Positivo,Não sei dizer
94,i2lqumo,"vão se foder ... quem não quer a porro do monopólio de um ano todo ... 

saudades oseas ...",Negativo,Negativo,Negativo
95,i2mkf1o,Já pensou se ele morre? Ia ser uma loucura essa eleição.,Neutro,Neutro,Não sei dizer
96,i2nehzt,Quem vai “cholar” mesmo vai ser você passando fome quando esse corrupto fuder esse país novamente :).,Negativo,Negativo,Negativo
97,i2qpk02,Paris se tornando a versão rica do Rio de Janeiro.,Positivo,Negativo,Não sei dizer
