,id,Comentário,class1,class2,class3
489,j1ryffs,"&gt;!pq vc nao levou uma bomba pro estadio?!&lt;

vc viu algum jogo do brasil? se sim como foi a torcida no estadio na cantoria?

pq a impressao q dava principalmente no jogo contra a croacia era de q a torcida cantava por uns minutos mas ficava calada a maior parte do jogo, e nesse jogo especificamente, so foi cantar de verdade depois do gol do neymar na prorrogaçao (!!!)",Negativo,Neutro,Não sei dizer
490,j1siwrh,"duvido, porém duvido de pau duro",Não sei dizer,Neutro,Negativo
491,j1w1gpm,"Eu sinto muito, mano",Negativo,Negativo,Positivo
492,j21nxob,Se for um hotel mesmo eles nem ligam pra esse negócio de visita...,Neutro,Negativo,Negativo
493,j240g65,"&gt;Capitalismo não rejeita movimentos sociais, desde de que propridade privada e livre mercado sejam mantidos

o problema e que você ou tem ""livre"" mercado e propriedade privada dos meios de produção, ou você tem direitos trabalhistas, porque se fosse depender dos donos das fabricas a gente ainda estaria no sistema escravista",Neutro,Negativo,Não sei dizer
494,j26z47y,"Dboa, boa noite pro cê",Positivo,Positivo,Positivo
495,j297bx7,Parece que alguém não *Fodeu geral...*,Negativo,Negativo,Negativo
496,j2deanp,Faltou o meteoro,Negativo,Neutro,Não sei dizer
497,j2dsgqa,Parece fanfic de menina de 15 anos,Negativo,Negativo,Negativo
498,j2embkd,"Ah, eu entendi sim que era humorístico, só estava comentando por comentar que o Corno McGregor também é lixo, e para ressaltar que, felizmente, tem lutadores muito mais ""gostáveis"" do que eles, inclusive no Brasil.",Negativo,Neutro,Neutro
499,j2fn7bl,"Sofro desse problema.
É uma desgraça KKKKKkKKKKKKK",Neutro,Negativo,Negativo
0,hr2gh2r,"Nunca pisaria em um helicóptero, ainda bem que sou pobre entao não é um dilema",Não sei dizer,Negativo,Negativo
1,hr71kgz,"eu nao conheço muito tambmé nao, mas gosto de qualquer vinho rosé, é bem gostoso beber gelado (:",Positivo,Positivo,Positivo
2,hrd1diu,"Ney ta quanto?

Edit : acabei de ver que vc postou o link em comentário, ta 56. Que queda.",Não sei dizer,Neutro,Negativo
3,hrfkibm,"Tá, mas reduzir pra quanto? Não adianta ter o maior ídolo jogando, se ele tem salário que equivale a 5 jogadores.",Negativo,Positivo,Neutro
4,hrhg7e4,"Cara faz comércio exterior, olha o tanto de idioma que tu fala... aproveita.",Positivo,Positivo,Positivo
5,hrn3hrz,Ele treinou a ave para pegar carpa e recompensa ela com peixes menores?,Neutro,Negativo,Neutro
6,hrwf72t,"Se o bandido ameaça te matar, você implora pela vida, por que não fazer isso também com sua conta, dizendo que nao vc não tem.",Negativo,Negativo,Neutro
7,hrx636e,"Porque esse monitoramento pode ser usado por megalomaníacos, todos tem total motivo para se preocupar com essas tecnologias.",Não sei dizer,Negativo,Negativo
8,hrxlhfz,"&gt; Se eles não quiserem, não acontece

E o quê o Centrão quer, se não verba pro seus redutos eleitorais e mantenimento do seu poder? Logo logo, teremos mais escândalos de corrupção, ainda mais no Brasil pós-2014, com o ressurgimento em plenas forças do bloco.

Isso vai sempre acontecer enquanto o Brasil eleger políticos não por ideologia, mas por currais eleitorais de longa data e influência de líderes religiosos e da mídia.",Negativo,Negativo,Negativo
9,hrxr9hk,E uma cota de malha completa?,Neutro,Neutro,Neutro
10,hs3pvef,"Não, teve até torcedor do Benfica protestando porque o cara parecia que tinha intenções de transformar o time num Crystal Palace B (o Textor é dono de parte do Crystal Palace).",Neutro,Neutro,Neutro
11,hsf7xoq,"tem gente que pega um Direita lifestyle na qual você entra em uma bolha de só consumir produtos e mídia de direita e ficar se achado o fodão por isso.

tão ridículo quanto parece.",Negativo,Negativo,Negativo
12,hsfqrdg,"Sim, é. Mas a prioridade sempre é de quem sofre o abuso.
Pq esse FDP vai abusar de mais pessoas.",Negativo,Negativo,Negativo
13,hsihs4z,"O negócio é comprar esse tênis agora por 900 e nas eleições vender por 1900, trade de tênis.",Neutro,Neutro,Neutro
14,hsixrb2,"Corretor de imóveis, corretor de seguros, etc…

São poucos mas tem",Neutro,Neutro,Neutro
15,ht4fvek,Essa é realmente a opção mais segura skkdkdksk boa :),Positivo,Positivo,Positivo
16,ht6p4qs,"Caraca velhinho que mundo você vive que não vê notícia nenhuma? Só de cabeça alguns exemplo:

* Estados Unidos: Qualquer imigrante, principalmente contra Mexicanos;
* Bons países da Europa: refugiados dos países árabes;
* China: atualmente contra pessoas de países africanos;
* Países árabes: países do ocidente principalmente os terroristas americanos

[Por conta do covid inclusive aumentou contra asiáticos](https://www.brut.media/us/news/coronavirus-spurs-xenophobia-around-globe-a237370a-f8c9-415a-9738-40fe1220c997)

ps: e olha vc pegando novamente apenas uma parte do que as pessoas escrevem e saindo do tema... Na moral, dá para ver que vc é treteiro e ou tá trollando ou só querendo discutir... vou parar de te responder pq tenho mais o que fazer, bom dia pessoa, bejo tchau.",Não sei dizer,Negativo,Negativo
17,htdvaqr,"Regulamentar uma área é dar transparência ao processo democrático. Algo que sempre faltou aqui no Brasil. O qie a regulamentação evita e justamente a criação de oligopolio como a globo. Não há pais de primeiro mundo em que não tenha uma regulamentação da mídia. 

""Processo"" ?!?! Realmente, milhões de leitores verão seus comentário e o próprio presidente vai pedir sua cabeça. 

Atacar a mídia não é xingar a globo cidadão. Veja quantos jornalistas mortos/perseguidos/agredidos por influência desse governo.",Negativo,Negativo,Neutro
18,htfe9un,"você sim, as outras 99 pessoas que são facilmente manipuladas não, conclusão: seu ex-candidato, provavelmente corrupto, vai ganhar a eleição e não há nada q possamos fazer",Negativo,Negativo,Negativo
19,htgr5by,Tenta leite de coco. É uma delícia!,Positivo,Positivo,Positivo
20,htiv642,"**OBS:** Esse meu comentário eu fiz em outro sub reddit dias atrás, era uma pergunta diferente, mas tbm sobre o Alemão, e desculpa pois eu gosto muito do idioma e acabei me empolgando e escrevi um textão, mas espero que te ajude de algum jeito.


  

  
Eu comecei a estudar alemão em março de 2020, ou seja, quase dois anos. Os maiores avanços ocorreram nos primeiros 6 meses, claro, pois saí do zero pra um conhecimento básico o que dá a impressão de ser muito mais coisas. Uma coisa que eu fiz foi não estudar nada de gramática mais pesada nos primeiros 6 meses (digo, as declinações regras de estrutura ou de casos verbais muito loucos) e fiz isso porque estudar esse tipo de gramática naquele momento seria inútil pois eu não conseguia entender nenhuma frase que saísse daquelas padrão duolingo, então a gramática seria mais um atraso do que um aprendizado. E o app Duolingo foi essencial nos meus primeiros 6 meses, se você tem conhecimento 0 de alemão, do vível que nem sabe dizer eu, tu, ele e as cores, recomendo o duolingo nos primeiros 6 meses, vai ser ótimo, depois você pode abandonar ele, pois vai se tornar monótono e muito muito chato.
  

  
Depois dos seis meses comecei a ver sobre gramática, porém sempre como uma caixa de dúvidas porque creio que a gramática, assim como todo mundo aprende sua lingua nativa, você adquire com o falar e com a repetição de diálogos e estruturas. E algo que eu sempre fiz, todos os dias desde que eu comecei a estudar, foi ver conteúdo em alemão pra treinar os ouvidos, seja um vídeo ou um podcast. Claro que eu no início não entendia nada, com um tempo eu n entendia nada mais 1 palavra, depois entendia metade das frases até que eu comecei a entender no mínimo 60% de todo vídeo que eu assistia. Hoje eu consigo entender muitos sons e palavras, eu só não tenho todo o vocabulário, porem se eu ouvir uma frase eu provavelmente saberei escrever cada palavra que eu ouvi e buscar o significado dela depois, pois meu ouvido já ta treinado a ponto de identificar as palavras muito bem e acredite entender é mais importante que saber responder.
  

  
Leitura eu não sei bem como foi o processo, mas com certeza a minha principal fonte de contato com textos em alemão é o reddit, pois tem muitos subs aqui em alemão o que ajuda muito pra ler textos com uma escrita corriqueira. Pelo menos 1 texto por dia eu leio e minha leitura é lenta comparada a que tenho no ingles mas eu consigo entender uns 60% do que leio, e isso pra mim já é o suficiente pra me virar por aí, dependendo do texto eu as vezes só não reconheço 1 ou 2 palavras, isso me alegra bastante. Alguns exemplos de subs que você poderia dar uma olhada r/WriteStreakGerman (são pessoas aprendendo alemão que escrevem textos de todos os temas e tamanhos e são corrigidas por nativos), r/FragReddit (versão em alemão do AskReddit, são pessoas fazendo pergunta pras pessoas responderem), r/ich_iel (essa é de memes, uma maneira muito boa de aprender girias, palavras do dia a dia e coisas de cultura corriqueira), tem muitos mais porém acho que depois de entrar nesses as coisas vão te aparecendo.
  

  
A coisa que mais me dá dificuldade é conversação, seja escrevendo ou falando, pois a coisa mais dificil no alemão vai ser quando você quiser formas sentenças complexas com condicionais e tempos verbais específicos do dia a dia. O que te recomendo, encontre algum alemão nativo disposto a te ajudar, alemães são legais e pelo menos os que eu conheci gostavam muito de me ajudar. De inicio eu falava em ingles com eles e perguntava duvidas de pronuncia ou de gramática, com um tempo eu comecei a mandar mensagens em alemão e pedindo pra eles falarem em alemão de volta comigo, e por aí vai. Você ter contato com um nativo é essencial, pois existem coisas que o google não consegue te ensinar, ou nuances que somente uma pessoa pode realmente te fazer entender e não tenha medo de errar :)
  

  

  

  
Eu ainda to estudando alemão, to longe de um nível fluente ou que me seja satisfatório, então caso queira algum companheiro de estudo pode mandar msgm.",Positivo,Negativo,Positivo
21,htnt0uv,"&gt;saber que pelo menos isso a bolha percebeu.

Percebeu do jeito deles né, escrevendo uns textões explicando como o OP é incel e que música erótica existe desde os anos 70.

Até atacaram igreja ali do nada KKKKKKKKKKKKK.",Negativo,Negativo,Negativo
22,htvye4t,"Problemas mentais, me desculpe.",Neutro,Negativo,Negativo
23,htwu9ag,"Meu, pior que a Indepas vai conseguir fazer voltar a ser “cool” chamar são paulino de apelidos homofóbicos* só por esse drama todo",Não sei dizer,Negativo,Negativo
24,hu0ktl5,"Chato isso. Imagino sua indignação. Mas sabe de uma coisa que aprendi há uns anos? Se você não esperar NADA de NINGUÉM, você não se decepciona mais. Não espere nada que venha de outra pessoa além de você. Não imagine que vão reconhecer, pois ninguém reconhece nada, só tenha ao seu lado ou ligue pra opiniões que venham de você ou de pessoas realmente queridas. Muitas vezes ligamos para o que não é digno de nossa atenção. Mas, se você começar a praticar (diariamente) esse ensinamento que deixei aqui pra você (o de não esperar nada de ABSOLUTAMENTE ninguém), você se sentirá feliz boa parte do tempo, e o ego seu não mais estará ferido. Tente. Não custa nada. E você verá como em pouco tempo você estará pouco se lixando para o que fizerem/disserem sobre você.",Negativo,Positivo,Positivo
25,hu5qlry,"&gt; A internet serve para, entre outras coisas, discutir assuntos sérios, não ganhar discussões.

A internet serve para um monte de coisas, ganhar discussões pode ser uma delas sim.

Interessante que eu colei a regra inteira e para ""refutar"" você só endereça o titulo dela...",Neutro,Neutro,Negativo
26,hu6evmg,Vc falou a mesma coisa 2 vezes.,Não sei dizer,Negativo,Neutro
27,hu7va5u,"Tem o Retro Goal, que é daorinha (inclusive tem campeonato BR com série B), mas depois de um free trial é pago. É do mesmo pessoal que fez Retro Bowl.",Positivo,Neutro,Neutro
28,hufnz2h,"Lógico que ele tá errado. Só porque ele aponta fatos e história, não significa que é certo repetir a história. “Poxa, lembra quando a Alemanha começou uma guerra mundial? Por que eu não posso começar uma também?” 

Ah, vá se fuder Putin.",Negativo,Negativo,Negativo
29,hundpvq,"“Hoje é dia de morrer.”

“Subiu no telhado” = “Morreu”",Não sei dizer,Negativo,Neutro
30,huqofxm,Passaporte&gt; cachorro quente com purê&gt;&gt;&gt;&gt;&gt;&gt;&gt;&gt;&gt;&gt;&gt;&gt;&gt;&gt;&gt;&gt;&gt;&gt;&gt;&gt; cachorro quente só com o krai da salsicha,Negativo,Neutro,Neutro
31,huu567d,"Eu percebo que tenham um sentido de humor gigante, mas às vezes estendem-se nas piadas",Não sei dizer,Neutro,Neutro
32,huw29zu,Aqui já fazem isso,Neutro,Neutro,Neutro
33,hv0j251,"Não vote no PT, não vote no PL, temos Simone Tebet !",Neutro,Neutro,Negativo
34,hv5u7b3,"Já roubam os times da CONMEBOL, mas quando chega gente de fora na final é ainda mais na cara dura",Negativo,Negativo,Negativo
35,hvc2i22,"Preocupa não... 

segue os 'primos ricos' da vida que ajuda bastante... 

*\[contém ironia\]*",Negativo,Negativo,Negativo
36,hvrb5vl,Tu fala isso pro médico que você vai?,Neutro,Negativo,Neutro
37,hw02zcs,"E o que vc espera obter da ""taxação dos ricos"" ?",Neutro,Neutro,Neutro
38,hwkzagw,vc mereceu lazarento,Negativo,Negativo,Negativo
39,hwlasnu,"
&gt;Nem todos os clubes divulgam todos seus dados.

Pelo estatuto do torcedor, é obrigatório divulgar o balanço do ano anterior até abril. 

O nível de detalhamento que pode mudar, por exemplo um clube pode colocar o gasto com salários de todo o departamento de futebol, sem especificar o que é para atletas e o que vai pra outros profissionais dentro do departamento. 

Mas pelo que eu entendo (que não é muito), analisando o balanço dá pra ter uma estimativa bem precisa.",Neutro,Neutro,Neutro
40,hwlwkdy,Só quero ver o avião presidencial do Brasil sobrevoando uma provável zona de guerra no dia 15. Os coitados dos pilotos e a tripulação devem estar roendo os dedos por conta das sandices do habitante do Palácio do Planalto.,Positivo,Negativo,Negativo
41,hwo85xd,"Essa é oficialmente a segunda match thread mais comentada do sub, perdendo apenas par a final da libertadores de flamengo x palmeiras com 4.5k de comentários",Neutro,Neutro,Neutro
42,hwpsm50," As pessoas passaram a ter uma visão parecida com a sua ha algum tempo. 
 Veja, na religião, há uma dimensão que é Deus pessoal, você conhece Ele, de certa forma, como conhece uma outra pessoa. Ele não está somente na Bíblia ou no “céu” mas é acessível através de oração. É um pouco diferente do que você descreveu aí. Sugiro que você faça uma oração sincera e coloque esses seus pensamentos nela descritos no post nela.👍🏻",Positivo,Positivo,Positivo
43,hx4ah7g,E ganhar voto agora é garantia de relevância e sensatez? Não que o pco seja sensato.,Negativo,Neutro,Negativo
44,hxe94bt,caralho guarda elas com o que no postinho?,Negativo,Negativo,Neutro
45,hxixh07,"Isso...
Mas vai falar isso pra lacrador...
Eles querem mais filosofia e menos matemática no ensino básico
As pessoas tem q saber politica e questionar o sistema dizem eles...",Neutro,Negativo,Negativo
46,hxlbhed,Tem a pegadinha aí. Se for demitido não saca nem um centavo por dois anos. Não sei onde esse pessoal pensa que pegar adiantado e pagar juros compensa.,Negativo,Negativo,Negativo
47,hxqdajg,"Nossa, não tinha pensado por esse lado.. vou tentar ser mais paciente :)",Positivo,Positivo,Positivo
48,hxtsfgx,"Eu conheço um monte de palmeirense que se acha italiano, acho xaropice demais hahaha",Negativo,Negativo,Negativo
49,hxzq402,"Você não saber que deveria divulgar uma pesquisa já com as fontes faz de você o burro. Você saber que deveria ter colocado as fontes e não ter colocado, faz de você burro de outra maneira. Pode ser que eu seja burro, é possível, serei o último a saber, por isso não posso te informar caso o seja. Respondendo: você publicar as fontes agora não me faz burro. Você pensar que eu me classifico como burro porque você publicou as fontes, só mostra que você é burro de uma terceira maneira diferente. Bem, temos aqui uma possibilidade de eu ser burro e três maneiras diferentes pelas quais você pode ser burro. Suas chances são altas. Se considerarmos a foto do Dória, já é uma quarta. Parabéns, senhor ""prejudicing the region's development"". Aliás, supondo que você quis dizer que o clima é que prejudica o desenvolvimento da caatinga, você é, finalmente, com certeza, burro de uma maneira específica. Portanto, concluímos, que você é burro de uma maneira e pode ser burro de outras quatro maneiras. Parabéns.",Negativo,Negativo,Negativo
50,hy0e0c3,Cold Brew.,Neutro,Neutro,Neutro
51,hy1yy6l,"&gt;O cara chegou em duas finais de Libertadores nos últimos 5 anos. Só o Gallardo recentemente conseguiu isso.

abel ferreira treina volei?",Positivo,Negativo,Negativo
52,hy95dks,"Ah blz, como vc tem a limitação de não extrapolar uma vírgula  na frase, e perceber a diferença no sentido geral, não ia entender as fotos do post com certeza.",Negativo,Negativo,Negativo
53,hybmj3q,"Premio de fake news né, pq ele só falou abobrinha",Negativo,Negativo,Negativo
54,hyejt7g,"Uau, piada de homem &gt; mulher. 

Dá até um pouco de pena do OP.",Não sei dizer,Negativo,Negativo
55,hyh5lkk,sempre achei curioso como ele conseguiu jogar bem em 4 gigantes europeus que rivalizam entre si (inter x milan e real x barça). só falou ter jogado no ajax por conta do período de PSV.,Positivo,Neutro,Neutro
56,hymwss7,[link do tweet]( https://twitter.com/OBCWXZiaY9HeMY6/status/1497792017581023232?t=Fjcm_OdKXfggzroLnt4h8A&amp;s=19),Neutro,Neutro,Neutro
57,hyuntgm,"você corre o risco de me ajudar, veja só que coisa.",Não sei dizer,Positivo,Positivo
58,hyxj1ag,"Golpe que o fantoche recebeu, aham tá. As eleições de 2019 que elegeram o artista foram legítimas, o segundo turno foi entre um bilionário e Zelensky, ambos pró Europa.

Não posso dizer a mesma coisa sobre o outro lado ditador que financia a direita mundial.",Negativo,Negativo,Negativo
59,hz6byy0,Quem falou de socialismo de mercado foi lenin e isso foi adotado no início da União soviética como forma de desenvolver o país quase-feudal. Como isso se diferencia de leninismo?,Neutro,Neutro,Neutro
60,hz9dnns,"Pô, Man, assiste Haikiyuu
As vezes te inspira um pouco. Ah, e também o Arthur Zanetti é mais baixo que tu(por mais que o esporte dele seja bem diferente dos que você tá falando que curte)
Mas é a vida, né?!! Tenho 166,5cm de altura e continuo jogando vôlei e praticando esportes que curto 👊🥝",Positivo,Positivo,Positivo
61,hzdc3nz,"Mas calma a Rússia é uma democria, eles só estão invadindo  a Ucrania para combater o nazismo do ator lá que fazia série.",Negativo,Negativo,Negativo
62,hzllc99,Maldita ilusão depois daquele gol do Sancho!,Negativo,Negativo,Negativo
63,hzluvax,"Posso ser sua webnamorada.

Valor do contrato é de 15k de salário mensal, PJ.",Não sei dizer,Neutro,Negativo
64,hzr8nau,"Então, tem isso também. O inapto acaba dificultando a vida dos que sabem de fato e inclusive causando acidentes. Moto fora do interior precisa de bastante atenção.",Não sei dizer,Negativo,Neutro
65,hzsrvpc,"mano é mt incerto dizer se tem ou não, acho q isso q da a graça na vida viver c algumas eternas dúvidas q nunca vamos saber oq é até realmente passar",Neutro,Neutro,Positivo
66,i024jc6,VASCO E NADA MAIS,Não sei dizer,Neutro,Positivo
67,i048w78,Olha temos um ENTENDIDO do assunto 🙄,Negativo,Negativo,Negativo
68,i058372,"Não querendo falar que você está errado, mas usar algo como ""provavelmente teu pai já fez isso alguma vez também"" é algo bem desrespeitoso e um argumento bem falho. Presupor que o pai dele já fez isso alguma vez não é só uma ofensa para o pai, como para o próprio OP. E não muda nada a situação em geral, ambos continuam errados.",Neutro,Negativo,Negativo
69,i06h8te,Para de dar ideia cara,Negativo,Negativo,Negativo
70,i07397k,Vai trabalhar no shopping.,Neutro,Neutro,Neutro
71,i0835l2,"Vai se tratar brother, tu tá incomodado com um cara colocando gasolina em galões.",Negativo,Negativo,Negativo
72,i0jhdy3,"Na verdade a mongolia invadiu o japao duas vezes. Na primeira eles perderam em terra, e na segunda invasao, foram parados pelos ventos. 

Finlandia chegou a um acordo, e cedeu uma parte do territorio. Depois de matar muitos sovieticos.

&gt;Grecia se fodeu para a Alemanha.
Etiopia se fodeu para a Italia na segunda vez

exatamente. Na SEGUNDA, mas a italia perdeu na primeira, nas duas invasoes.",Positivo,Neutro,Neutro
73,i0lyzah,"Se eu fosse você não faria na Av Paulista tem bairros movimentados que você pode fazer isso ou algumas entradas de metrô, acho que é menos perigoso disso acontecer",Neutro,Positivo,Neutro
74,i0vqxyv,"Beleza conta muito hoje em dia, mas a mentalidade tmb amigo, se você já chegar na derrota não vai arrumar nada mesmo, sempre dá pra melhorar o físico mas o mental é difícil, eu moro numa parte bem merda do rio de janeiro e amigo aqui parece o bueiro só tem maluco desgraçado de feio e esses caras são seletivos pra caralho, já vi uns cara destruído com mina lindíssima, eu sei que é uma merda ser feio amigo, mas isso não é desculpa não.",Negativo,Negativo,Negativo
75,i0yu607,QUE ARBRITAGEM FILHA DA PUTA VAI SE FUDE,Negativo,Negativo,Negativo
76,i11xaq9,"&gt;Turquia  
&gt;Europa

escolhe um",Neutro,Neutro,Neutro
77,i13e4bw,Procure um profissional que possua registro no CFT e que seja indicado por algum amigo que já conhece o trabalho dele. Elétrica requer segurança e profissionalismo!,Neutro,Neutro,Neutro
78,i1j9ra5,"a minha primeira namorada era meio assim, aquela ordinaria do caralho.

a gente começou a namorar logo depois dela terminar um relacionamento de 8 meses. ela terminou comigo um mês depois. na real, ela só não queria ficar sozinha. tem gente que é assim.

enfim, vc falou que ela vem ki vem ki vem kickando 🎶🎶 toda vez que vc se afasta. tenta dar um perdido monstro nela pra ver qual é a real.

ou simplesmente chega nela e manda o papo reto que nem homem. eu fiz isso com a minha primeira e ela terminou comigo na hora 😎",Neutro,Negativo,Negativo
79,i1ntib5,Que é um decore??,Neutro,Neutro,Neutro
80,i1osu21,"Sim, tenho certeza que existem milhões de rolês acontecendo no mundo e a maioria deles vc não é convidado",Negativo,Negativo,Negativo
81,i1powlq,"Então é mais fácil morrer no morro do Rio que na guerra?

Arrimaria...

Heueheueheu",Negativo,Negativo,Neutro
82,i1sev0a,"Se eu fosse seu amigo, eu iria querer saber disso tudo que ela fez… acho que fazendo isso serviria pra acabar com o encanto da pessoa de vez… amigo que é amigo de verdade faria o msm, eu faria o msm.

Se deixasse quieto, e seu amigo um dia por acaso descubra, vc com certeza ia se ferrar legal… então é melhor deixar tudo claro agora do que acontecer o pior no futuro.

Independente se ela n tem mais nada a ver com ele, acima dessa relação q eles tiveram vcs são amigos, essa sua transparência foi um ato honroso da sua parte e eu não ficaria mal caso seu amigo ficasse pé da vida com vc, vc deixou claro desde o começo q nunca teve nada com ela… ele ter ficado com tal atitude perante vc só demonstra como ele foi infantil… no fim cada um sabe o que é o correto, se ele tiver um pingo de juízo um dia ele vai te entender e valorizar amizades como a sua.",Negativo,Positivo,Positivo
83,i1x4kyn,Prefiro ser corno do que ter Valentim como técnico,Negativo,Negativo,Negativo
84,i1xg1k5,"Nano machines, son!",Neutro,Neutro,Neutro
85,i21lwtc,"Sério que o problema é tirar do peito??? Kkkk
A nota passou por milhares de mãos, se pá foi usada algumas vezes pra cheirar cocaína, provavelmente tossiram e espirraram em cima, pode ter ido parar no chão, caído dentro do vaso sanitário e sua preocupação está em tirar uma nota das tetas velho??? Cê tá louco. Kkkkkk",Negativo,Negativo,Negativo
86,i223uag,NAO DA PRA MORAR EM PORTUGAL KKKKKKKKKKKKKKKKKKKKKKKKKKKKK  (la existe a marca dos m&amp;m's mas la  tem uma propaganda  assim 'partilhas com o gozao' nao tenho maturidade pra morar lá),Não sei dizer,Negativo,Positivo
87,i24omtf,"Exatamente isso, kkk.",Positivo,Neutro,Neutro
88,i26o1i0,"Uma amiga minha caiu num golpe no ano passado mesmo eu alertando. 

Quando a pessoa está disposta em acreditar numa mentira, não adianta alertar.",Negativo,Negativo,Negativo
89,i2ill8b,"Santa Catarina. É tudo de ruim que o resto do país pensa do Rio Grande do Sul, mas 3x pior.",Negativo,Negativo,Negativo
90,i2jl65q,"Puta que me pariu viu, algm taça uma bomba em Brasília e chama os  Bragança de volta",Negativo,Negativo,Negativo
91,i2sseds,Hat trick do homem,Neutro,Neutro,Neutro
92,i32flpr,da casa do caralhos vinhemos para casa do caralho retornaremos,Negativo,Negativo,Neutro
93,i34nz5v,"Tu sabe que o país tá fudido quando pessoal decide em quem votar antes dos debates e propostas anunciadas.

No trampo anterior, eu discutia direto com um acéfalo que defendia o bozo no clássico disser, até que certo dia:

 tongo:""MaS  e O peTE? FeZ pior""
Eu: caramba n falei do PT na conversa, estou criticando o governo atual! Acorda!
Tongo: Ué?! Mas se tá falando mal é petista.
Eu: ñ, nunca falei q sou Lula,  os dois devem ser presos .
Arrombado nunca mais falou de política perto.",Negativo,Negativo,Negativo
94,i35c58u,"O Brock é péssimo e o Oliveira pior, mas num invalida o comentário do jovem aí",Neutro,Negativo,Negativo
95,i36qmeu,Não chama o país de merda cara...,Neutro,Positivo,Negativo
96,i39efmf,"abel, o time precisa do 👉😑👈",Não sei dizer,Neutro,Neutro
