,id,Comentário,class1,class2,class3
0,hr39bh3,"Olha, vou falar sobre a minha experiência. Fui muito privilegiado de ter uma educação e um ensino superior, tanto que hoje consegui trabalhar na área de formação, mas vou te falar uma coisa todo dia que eu levanto eu tenho vontade de desistir, ir pra alguma coisa que me traga alegria nem tanto dinheiro já que o emprego atual também não paga lá essas coisas. Mas é como você descreveu, eu vou sair de um trabalho com ganho garantido ao final do mês para uma coisa incerta? Não falta vontade mas o medo de não dar certo prende a gente nesse modo de vida.",Negativo,Negativo,Negativo
1,hr4zdgd,"Intervencionismo externo visando ganho próprio e sem estudar a situação complexa e possiveis consequencias.
Um clássico dos estados unidos de merda",Negativo,Negativo,Negativo
2,hr673em,"AWS é vida!! Hehehe
Uso e recomendo o todos os meus clientes (sou de TI)",Positivo,Positivo,Positivo
3,hrd2klr,"Se fosse assim, quem morrer de parada cardíaca e não tomou a vacina, eu poderia dizer que foi pq não tomou?",Negativo,Negativo,Neutro
4,hrflhlt,"Em momentos como o atual, tomar medidas de precaução que custam bastante dinheiro é sofrido mesmo.

Eu tive que trocar de óculos. Meu grau de miopia é muito alto e fazia tempo que eu não trocava. Gastei 1400 reais depois de barganhar pra caramba e pegar a lente mais barata que tinha na loja.

Não me arrependo, mas doeu na alma",Positivo,Negativo,Negativo
5,hrl9jpy,Tudo eleitor do Bolsonaro,Não sei dizer,Negativo,Neutro
6,hrs3n3y,"Putz, se bobeasse tava escrevendo isso no r/farialimabets",Não sei dizer,Não sei dizer,Neutro
7,hs49oxz,Não disse que não ia gostar,Positivo,Neutro,Neutro
8,hs9tiar,Veja no seu prédio quanto costumam cobrar... Aqui no meu é 400 a vaga.,Neutro,Neutro,Neutro
9,hshrlwk,Raw (2016),Neutro,Neutro,Neutro
10,hsjgsqf,quais cursos você fez?,Neutro,Neutro,Neutro
11,hsm5fg1,"Para mim, ele é branco.",Não sei dizer,Neutro,Neutro
12,hsmyeqw,"…

…

Já passou pela sua cabeça quem sabe,talvez, talvez, ir num médico?",Negativo,Neutro,Neutro
13,hsnbtds,"Rapaz já vi muito disso, principalmente quando disponibilizam cupom e tem algum prato em promoção. Daí a tática é colocar algum pequeno adicional de 1 real ou 2 até atingir o mínimo.",Positivo,Neutro,Neutro
14,hsncxtq,"A resposta, a meu entender, é que a sociedade não vê casais homo como algo normal.

Tem gente que chama isso de homofobia, e acreditam que com o tempo podemos ensinar à população que existem homossexuais e que eles não são pessoas menos dignas por conta da orientação sexual. Sou uma dessas pessoas.",Não sei dizer,Positivo,Positivo
15,ht3dm01,Big Brother é antropologia.,Neutro,Não sei dizer,Neutro
16,ht9my53,"Relações Internacionais.

A base do curso é história e política, tem MUITA leitura - clássicos da filosofia, livros imensos de história global, biografias de líderes, documentos oficiais, teoria política, etc etc etc - e muita escrita também. É comum os graduados de RI irem pra área acadêmica justamente por tanta produção acadêmica que é incentivada a ser feita na faculdade E pela deficiência do mercado de trabalho. Pra quem gosta de estudar, é maravilhoso. Você aprende sobre política (de verdade), geopolítica, organizações internacionais, legislação, história, economia (macro e micro)... é realmente um arcabouço gigante. Você aprende a fazer análise de discurso e teorias, prospecção de cenários também, o que é muito legal. 

Uma memória que guardo com carinho da graduação foi uma aula sobre táticas de guerra em que assistimos alguns vídeos de Game of Thrones e comparamos com umas passagens de um livro de Alexandre, o Grande para fazer uma análise das táticas empregadas nos dois casos.  

Sobre o mercado de trabalho: é horrível. Por se tratar de um curso extremamente amplo e interdisciplinar, a gente compete com pessoas com formação mais robusta. Se é uma vaga de financeiro, competimos com formados em Economia; se é uma vaga em Direitos Humanos, com formados em Direito; se é uma vaga em Relações Institucionais, com formados em Administração e Direito; e assim vai. Ou seja, é imprescindível fazer uma pós graduação pra se estabelecer como ""profissional"" em uma área. Muita gente vai pro caminho do Mestrado pra essa especialização e pra seguir na carreira acadêmica, buscando também o incentivo das bolsas pra se manter enquanto não entram no mercado de trabalho. 

A maioria dos meus colegas estão ou no mestrado/doutorado ou fora da área de atuação. Mesmo os que estão no mestrado/doutorado não tem boas perspectivas por conta dos concursos públicos escassos, e mesmo os cursos particulares de RI contratam professores formados em outras áreas mais específicas (Direito, economia, etc) e poucos professores de RI de fato. 

Eu sou uma das poucas que está na área, e só consegui por conta de indicação: fiquei 7 meses buscando emprego na área (morando no Rio de Janeiro) e não consegui só na abordagem dos currículos, consegui a vaga porque o responsável é meu ex-aluno. É um mercado complicado e altamente competitivo. Se eu soubesse de tudo que sei, não teria feito outro curso porque tenho muito apreço pela área e pelo que pode ser feito dentro dela.",Positivo,Negativo,Positivo
17,htfz11y,"Outra sugestão: procure o perfil no Instagram de outros sebos, abra a aba de seguidores e siga todos que puder. Dessa forma você tá chamando para que olhe o seu perfil aquelas pessoas que seguem outros perfis de sebos, o que é uma seleção interessante do seu público-alvo.",Positivo,Positivo,Positivo
18,htinz29,"Esses fdps da mídia devem estar com o cérebro bombado de tanto fazer ginástica mental ...

""a criança tinha uma doença congênita rara"" ... Que fdps .

Os caras tem a audácia de mentir sobre a causa da MORTE de uma CRIANÇA de 10 anos ... Esses já tem um lugar quentinho no inferno ... Desgraçados .

""Edit"" : Acabei deduzindo que a criança havia morrido , mas estava errado , ela está viva , ainda bem !",Negativo,Negativo,Negativo
19,htm10xg,"A China não é muito exemplo de desenvolvimento humano, mas seria um sonho o Brasil crescer o quanto a China cresceu. É uma pena mesmo :/",Negativo,Negativo,Negativo
20,htmqs77,"Acho ""trikas"" brega. Mas tb acho que a Independente tá de ""pau-no-cuzismo"".

Pra começar, não representam todos os torcedores, representam apenas os seus associados. 

Segundo, tá de sacanagem que não permitem aos seus associados usarem brinco ou alargador! Esses caras são uma TORCIDA ORGANIZADA! Não produzem nada, não administram nada, não fazem absolutamente nada a não ser organizar gritinho na arquibancada e pintar bandeirão. Que raios tem um código de vestimenta rígido desses a ver com qualquer coisa que eles façam?

Terceiro, o fato de emitir um comunicado ""oficial"" em um tom carrancudo e mostrando que seus dirigentes se levam muito mais a sério do que qualquer outra pessoa os levaria s´ó vai ter um único efeito: fazer todos os torcedores rivais chamarem o SPFC de trikas.

Parabéns aos envolvidos.",Negativo,Negativo,Negativo
21,htyekmm,Se morrer tu não vai mais rir com comentários imbecis no reddit. Incluindo os meus que só falo merda pra caralho todo dia aqui,Neutro,Não sei dizer,Positivo
22,hu0r67k,"Também conhecido como ""velho normal""",Não sei dizer,Neutro,Negativo
23,hu1lat0,"Atualmente não, porque sou profissional de tecnologia. Mas se eu não tivesse essa qualificação, qual o problema? É um trabalho digno como outro qualquer. Pagando as contas e podendo viver com algum conforto, está ótimo.",Positivo,Positivo,Positivo
24,hu27ney,"cara, saindo um pouco dessa caixa... muita gente está indo fazer medicina no Paraguay, e ao fim do curso realizando a prova revalida. Conheço pessoas que ja atuam no Brasil fazendo este caminho.",Neutro,Neutro,Neutro
25,hu40bpn,"Mais uma que confundiu ""Fazer Enem"" com ""Fazer Neném""

Edit: obrigado pelo award!",Negativo,Negativo,Positivo
26,huah5rc,O doador era vacinado?,Não sei dizer,Neutro,Neutro
27,hub93yq,Campeonato de quarto,Neutro,Neutro,Neutro
28,hucpyw7,"Vai sim, vai pro ar em forma de cinzas",Neutro,Neutro,Positivo
29,hue9e7h,"&gt;Mas não, vamos ter o bozo no segundo turno, um cara que não sabe falar 3 frases sem se enrolar e vai fazer o debate virar um programa de humor.

\*não vai pra debate",Negativo,Negativo,Negativo
30,hufv82f,"&gt;Ou você quer entrar num emprego ganhando 5k e não quer que seu patrão ganhe 50k ? Quer ganhar igual ele ?

Sim",Positivo,Não sei dizer,Neutro
31,hui8v2m,"Esse não só é o pior jogo da seleção que eu já vi como também é o jogo com o pior árbitro, caralho que árbitro bosta, dá cartão pra tudo, fica de cu doce pra ir ver VAR, deixa toda situação escalar",Negativo,Negativo,Negativo
32,huovt7y,"Esse é o famoso ""se fazer de vítima e botar a culpa no outro"" mas eu acho que mesmo assim ele está uns 30% certo",Negativo,Negativo,Neutro
33,hv1mrr6,"Pandemia virou endemia o mundo precisa voltar ao normal. Esse ativo político que a esquerda quer usar para dominar o mundo de e passar e o mundo precisa se revelar economicamente contra quem usa essa arma política escrota para diminuir os negócios e espalhar misérias.

Fora políticos de esquerda covideiros do caralho!",Negativo,Negativo,Negativo
34,hv1xsjp,Não entendi,Neutro,Neutro,Neutro
35,hv8eqh4,"Discordo, pra mim é 2020-too, 2020 segunda temporada
2021 foi o OVA de transição",Não sei dizer,Não sei dizer,Positivo
36,hvcmwet,"A situação é bem mais complicado que isso. Estados Unidos precisam operar à uma certa distância da costa se não quiser ser obliterado pelos milhares de mísseis Chineses.

Sem contar que marinha, especialmente porta aviões, passa vários meses em manutenção, você nunca consegue projetar 100% da sua frota. 

Vai ser extremamente difícil pra China, porém não é impossível.",Positivo,Negativo,Neutro
37,hvmg0at,"A minha foi legal, mas olhando pra tras eu percebi a quantidade de merda que eu fiz, quantas pessoas eu machuquei, o jeito que eu agia, sei la, é bastante agridoce. Eu ja me martirizei muito por conta disso e hoje em dia fico com o pé atras de fazer novas relações. Faz parte. Foram poucas as pessoas pra quem eu pedi desculpas e hoje em dia eu não tenho mais contato com elas, mas essas pessoas tao bem e a vida delas continuou, a minha tb. Entao sei la, tudo isso pra falar q tudo bem vc esquecer, so nao deixa isso te jogar pra baixo, se desculpa e desculpa quem te machucou se der, isso tb ajuda. A gente anda olhando pra frente sempre",Positivo,Positivo,Positivo
38,hvoyxn3,"Pode pegar o tobogã e ir para baixo sozinho, eu quero viver",Positivo,Não sei dizer,Positivo
39,hvsbpyg,"Mano, o Lucas Lima não esperou nem 10 minutos do anúncio de contratação no Palmeiras pra começar a zoar o Santos. Tem gente que é chato pra krl por natureza.",Negativo,Negativo,Negativo
40,hvuoum3,"Relido. E seu texto continua passando o claro entendimento de que, pra vc, ele admitiu “exagerar” nos números.

E tom alarmista? Depois de mais de 650 mil mortos, milhões infectados, milhares com sequelas de longo prazo da doença (perda de capacidade respiratória, demência e vários outros) que custarão caro ao cidadão ou ao SUS, um desastre econômico afetando QUASE todas as camadas da população, e mesmo assim vc ainda achar que esse adjetivo de alguma forma se aplica ao tom que ele usou é de assombrar.",Negativo,Negativo,Negativo
41,hvvr8mi,"Sua puberdade então tá retardada, tenho 26 e esse fogo meu passou

Tesão tenho, mas não só de ver bunda grande, tem que ter a provocação e exibição",Negativo,Não sei dizer,Negativo
42,hw2bsl2,Eu tô fazendo isso msm kwskkwksek vamo ver se da certo,Positivo,Positivo,Positivo
43,hw60jzx,"Quatro desses vc consegue resolver, um desses vc consegue compensar.",Não sei dizer,Neutro,Neutro
44,hwaqv9s,"""kkk comunismo é quando morre de fome""

Cuba depois de 60 anos de sanções econômicas tem uma expectativa de vida maior que a dos EUA. E a expectativa de vida na Rússia caiu dez anos depois da queda da União Soviética e a adoção do modelo capitalista.

Falou pouco mas falou merda.",Negativo,Negativo,Negativo
45,hwffw2v,Basicamente textão pra falar como o liberalismo é o máximo sem nem se dignar a distinguir entre liberalismo e capitalismo e aproveitando pra jogar fortes doses de negacionismo histórico e da realidade atual. Só o típico pra quem vem com esses papinhos.,Negativo,Negativo,Negativo
46,hwi4c7y,"É EXATAMENTE ISSO CARA. Eu sinto que eu simplesmente nao posso ser eu, que eu preciso pelo menos fingir acreditar em alguma coisa, que eu preciso seguir algo pra não cair na desgraça",Negativo,Negativo,Negativo
47,hwn5caj,Ainda bem que eu não apostei. Ia perder 50 conto.,Positivo,Positivo,Positivo
48,hwns0af,"Scheiß auf den Krieg, heute ist ein Tag des Vergnügens. União sinistra im Blut Ich will, dass die Witzbolde von Grosser Tuchel das 1:0 gegen diese frechen Brasilianer mit einem Scheißdreck machen, den keiner hält. Ich freue mich darauf, die Engländer gegen diese Kinder gewinnen zu sehen und die Feijoada-Esser weinen zu sehen. Fußballland, du Oma.

Guten Tag, Sub. Das ist es.",Não sei dizer,Negativo,Não sei dizer
49,hwqkz9n,"Faz anos que eu não vou a um subway que não tá faltando alguma coisa 

As vezes eu ia em um perto do trabalho. Sempre tinha uma placa de isso ou aquilo faltando. Ai reclamei pra atendente e ela disse que era só impressão minha, que não era assim. Eu pedi meu sanduíche. Não tinham o recheio.",Negativo,Negativo,Positivo
50,hwwclol,Dai querem vir opinar no nosso jogo. Americano é foda… bom que não entendem nada,Negativo,Negativo,Negativo
51,hwzr3zr,Eu acho que ouvi um 🐄muuul,Positivo,Negativo,Positivo
52,hx032h3,Tô achando ótimo os downvotes que tô tomando por falar que essa gente é insuportável e elitista,Negativo,Negativo,Positivo
53,hx47557,"Por que ""se dane""? Tirando o fato da reforma da previdência que desagradou o eleitorado mais à esquerda, ela vem apresentando ótimos projetos na área da educação. Não vejo sentido em demonizar a Tabata.",Positivo,Positivo,Neutro
54,hx5rgxm,"No 360 eu lembro que podia escolher, atualmente é mais difícil ou o cara q n quis?",Neutro,Neutro,Neutro
55,hx7zvda,"Explica aí porque o Putin tirou as tropas, então.",Negativo,Neutro,Neutro
56,hxd3xjn,"Você fala como sé fosse a coisa mais fácil pra de se fazer né? Como o policial honesta vai fazer algo contra VÁRIAS  pessoas corrompidas pelo poder? Polícia desonesto a grande maioria só tem cargo altíssimo dentro da Polícia e não tem como o Policial comum fazer merda nenhuma, ele é coajido a aceitar essas condições se não a família dele fica sem oq comer no final do mês. Acorda filhão você ta no Brasil não no em um mundo da Disney, acha que é só o cara ir lá fazer uma reclamação ou denunciar o Policial desonesto e pronto? Se fosse assim séria fácil demais, não teríamos vários corruptos que tem na Polícia, essa reforma tem que começar na política pra BEM depois ir pra Polícia.",Negativo,Negativo,Negativo
57,hxfnce3,Experimenta falar um piu no sub sobre os campos de concentração na China hoje... Me assustei o quando o pessoal tá se perdendo por aqui.,Negativo,Negativo,Negativo
58,hxg0iib,"O que diabo é que o YouTube tem a ver com isso? O YouTube agora é OBRIGADO a pagar quem posta lá? Onde é que tá escrito isso nos termos de uso do YouTube ou na Constituição? Ninguém tá obrigando ele a usar o YouTube. O cara quebrou as regras da plataforma e foi demitido, ora. É como se tu quisesse continuar recebendo teu salário sendo demitido de uma empresa. Censura seria o Monark ser proibido de não acessar nada na internet, nunca mais.",Negativo,Neutro,Negativo
59,hxl0996,"Eu não gosto de muitas coisas que o bolsonaro faz/diz, mas concordo que inflação não é um problema causado por ele. Se lula estivesse no gov agora seria o mesmo.",Positivo,Neutro,Positivo
60,hxpx9mj,A esquerda não sabe fazer meme.,Negativo,Negativo,Neutro
61,hxryk6v,Ele come o co de quem tá lendo,Neutro,Negativo,Positivo
62,hxs5y41,Arana talvez,Neutro,Neutro,Neutro
63,hxwnaq2,"É isso! Seu pessimismo só confirma o que eu acho.
Espero que fique tudo bem por aí (vi seu user)",Positivo,Positivo,Positivo
64,hxyd3jk,Me coloca nesse grupo ai!,Neutro,Neutro,Positivo
65,hy5x3y3,Simplesmente: que pena.,Negativo,Negativo,Positivo
66,hyi9aya,plot twist: vc na vdd é Rogerio,Neutro,Neutro,Neutro
67,hz1o32u,"Concordo 100%.

Uns tempos atrás tava combinando com um pessoal de ver um filme no cinema. Aí fui ver o ingresso: R$30!! Todos desistimos. 

Imagina uma família com 2 filhos que pagam meia. Só de ingresso dá R$ 90!! Aí vai que os pais pagam a pipoca de R$ 25 (o milho mais caro do mundo), e duas latinhas de refri que dá mais R$ 15.

Aí foram R$ 130 gastos pra 2 horinhas de entretenimento! Se ainda fosse uma apresentação ao vivo, mas que nada, pra ver playback de um vídeo.

O que acho desesperador é colocar nessa conta também se a família resolveu comer no shopping antes ou depois do filme, num mcdonalds ou burger king. Aí um rolezinho bem besta desses passa dos R$ 250.",Negativo,Negativo,Negativo
68,hz1w1mv,"Olha eu não acho, pessoal que está demonstrando apoio aos Russos estão levando chuva de downvotes.

Já foi falado em outro Post mas tem dois perfis que apoia a Russia, extrema esquerda que por algum motivo ainda acha que a Russia é comunista sendo que não é a quase 30 anos, e a extrema direita que está contra a OTAN, EUA, Nova Ordem mundial, Iluminati e essas paradas todas.",Não sei dizer,Negativo,Negativo
69,hz3os4e,Rlx. Eles fazem a matrícula sem esse documento!,Positivo,Positivo,Positivo
70,hz3y6bu,"A boa notícia é que a ideai de inverno nuclear provavelmente está exagerada.

Os modelos que chegam nos resultados extremos de degradação da agricultura assumem 60+% de deposição de fuligem na estratosfera, devido aos incêndios que a bomba causar.

Eles também assumem bombardeios urbanos, e muitas vezes assumem que acontecem em estações propicias pra incêndios para chegarem nesses números.

Mas modelos mais recentes indicam que isso está meio exagerado, e que em geral 80% da fuligem não consegue ficar na atmosfera por mais de duas semana - isso implica que os efeitos climáticos de uma guerra nuclear vão se menores que o esperados, e uma guerra em ""pequena escala"" (100x Hiroshima) como uma troca Nuclear entre Paquistão e Índia teria efeitos pequenos no clima e agricultura.

A gente ainda não tem um cálculo usando os modelos modernos de deposição de fuligem na estratosfera para troca nuclear completa (1/3 dos Arsenais Russos e Americanos), mas sinceramente a gente vai ter sorte se tiver que se preocupar com os efeitos climáticos depois.

Fontes:

O modelo mais moderno de cenários apocalípticos com inverno nuclear. Se você olhar eles assumem a deposição quase direta de grandes quantidades de Fuligem (soot/black carbon) na atmosfera.

Coupe, Joshua et al. “Nuclear Winter Responses to Nuclear War Between the United States and Russia in the Whole Atmosphere Community Climate Model Version 4 and the Goddard Institute for Space Studies ModelE.” Journal of Geophysical Research: Atmospheres (2019): n. pag.

&amp;#x200B;

O modelo de deposição de fuligem pra troca nuclear pequenas, basicamente apontando que os modelos mais clássicos sobrestimam a quantidade de fuligem de positada:

&amp;#x200B;

[https://agupubs.onlinelibrary.wiley.com/doi/full/10.1002/2017JD027331](https://agupubs.onlinelibrary.wiley.com/doi/full/10.1002/2017JD027331)",Neutro,Neutro,Neutro
71,hz72u1t,"O tanto que esse podcast é recomendado pra mim é maluquice. Não aparece na home, aparece mais nos vídeos relacionados, mas porra menor.",Negativo,Negativo,Negativo
72,hzg1543,"então, não detalhei muito para não ficar muito longa a história, mas algumas pessoas desse pessoal ainda é menor de idade, mas não chega ser pré -adolescente sabe, em fim, bem chato os comentários. Então o dia que surgiu esse comentários maldosos que comentei por último, o menino faltou, mas no primeiro dia que ficaram fazendo esse burburinho a gente só parou de conversar, e no outro dia não nos falamos porque eu não fui sentar do lado dele para evitar falação, mas acho que o menino levou na boa esse zoeira. O que você falou de esquecerem com o tempo, talvez esqueçam essa fic maldosa nada a ver, mas acho que continuaram me zoando e tentando juntar a gente, eles fizeram até uma base de quanto tempo eles tem para juntar eu e o menino, ´porque no meio do ano eu vou sair da vã.",Negativo,Negativo,Negativo
73,hzhg698,"Na fronteira da Eslováquia e Hungria, países da Otan e ponto mais longe possível da Rússia na Ucrânia é que não está acontecendo nada mesmo.",Neutro,Não sei dizer,Negativo
74,hzj8z07,Sou pessimista. Boto 43%,Negativo,Negativo,Negativo
75,hzm9au8,Eu não acho nem um pouco seguro. A história monetária brasileira não é exatamente boa. Até 2045 pode não valer mais nada,Negativo,Negativo,Neutro
76,hzmztwx,"Relaxa cabuloso, na série b vem a superação",Positivo,Positivo,Positivo
77,hzozjt8,"Cobertura da Globo é uma das piores que já vi, pita que pariu.

Ontem diserram que o mundo estava em PAZ até semana passada, a Rússia que acabou com isso.",Negativo,Negativo,Negativo
78,hzp98dd,"Kim Katacoquinho.

O cara não quis se ferrar sozinho, ai levou o amiguinho junto.",Negativo,Negativo,Negativo
79,hzr30pf,No meio desses 2.7 anos John chutou uma pedra e foi ao médico agora tem uma dívida de 55 Nissan Versa 0km.,Não sei dizer,Neutro,Neutro
80,hztxjm3,o jeito q ele jogou a caneca entregou tudo,Negativo,Neutro,Negativo
81,hzvgwni,"Vou falar um relato aqui.

Um dia tava eu e minha família em uma casa lá no interior que era do amigo do meu pai.
Um dia meu pai saiu pra comprar carne para fazer um churrasco, e minha mãe foi tentar achar a família que era amiga nossa, e iria passar o fim de semana com a gente, então só ficou eu e meu irmão na casa.
Eu estava na piscina, mas decidi sair por algum motivo. Enquanto eu estava me secando, por coisa minha eu comecei a andar pelos arredores da piscina que ficava em um espaço na frente da casa, que era tipo uma garagem, aí eu olhei para o corredor que dava para um quarto que ficava bem no fundão da casa, foi aí que eu vi algo me olhando, mas rapidamente saiu, eu achando que era meu irmão, fui até lá mas não havia nada, a porta do quarto estava fechada, eu estava ouvindo algo que parecia gemidos, e então eu abri a porta e liguei a luz, aí me deparei com uma mulher de 19 anos aproximadamente, aí eu tava com uma puta vontade de bater a gloriosa e fui lá e comi ela e o cu de quem leu.",Neutro,Negativo,Positivo
82,hzze6gz,Mete um processo administrativo em quem te bloqueou. É assim que q banda toca nos If e ufs,Não sei dizer,Neutro,Negativo
83,i00lucc,ora ora se não é macho🗿📸,Não sei dizer,Não sei dizer,Neutro
84,i0411kh,Old. Tem o ângulo do cara do prédio também no reddit.,Não sei dizer,Negativo,Positivo
85,i04zuxz,"vai sofrer no futebol e na f1 pq essa equipe tem um carro de dar dó

mas se eu não me engano tem um piloto brasileiro nela!!",Neutro,Negativo,Negativo
86,i08x666,"O que isso tem a ver?

Tu já viu como que funciona entrega pro interior? Ou lugares mais isolados?

Vai pesquisar antes de falar merda, até as transportadoras mais caras terceirizam pro correio pq não vale a pena ter uma rota por lá.",Negativo,Neutro,Negativo
87,i0cxpa8,Não tem ninguém que vc goste? Algum lugar que queira visitar? Coisas que tem vontade de possuir?,Neutro,Positivo,Neutro
88,i0fjr7a,Concordo. A melhor parte do rolê é o after.,Positivo,Positivo,Positivo
89,i0p7q5j,"Bom negócio. Eu sinceramente não aprovo nada que envolva vender seu corpo ou você mesmo(a) de algum modo. Mas o corpo é seu e a vida é sua, faz o que quiser.

No final tu saiu com um puta lucro mesmo kkk",Positivo,Positivo,Positivo
90,i0q3dmd,"Porra, li os comentários e fiquei genuinamente surpreso de vocês estarem caindo nesse deepfake low effort...",Negativo,Negativo,Negativo
91,i0wk4jl,"Eu moro na periferia da Grande SP e detesto. Não vejo a hora de acertar algumas pendências financeiras pra voltar a morar em bairro da classe média na capital. Não suporto o barulho, a falta de estrutura e de educação das  pessoas. Só romantiza isso quem não vive assim.",Negativo,Negativo,Negativo
92,i0zza98,Tu não entendeu oq falei,Negativo,Neutro,Neutro
93,i188k2z,Compre uma late de spray e pinte em cima. Dependendo do que acontecer você tem a sua resposta.,Não sei dizer,Neutro,Positivo
94,i1bcr5h,"Um dia estava na casa da minha vó estudando tranquilo (ela mora em um morro extremamente inclinado). Dia lindo, vó linda, nada demais. Eis que do nada escuto um sonoro BAM de batida e prontamente deduzi a cena - epa, rolou um acidente aqui em frente muleque. Logo fui caminhando até a janela mas as pancadas continuam: BAM.... BAM, BAM, BAM, BAM, BAM, digo - É o que, home? - meus poderes de dedução desapareceram. Corri. Quando abro a janela vejo a própria cena de guerra: 5 ou 6 carros amaçados, 2 deles capotados, alguns vazando gasolina e ao fundo um carro varado dentro da casa que dava fim ao morro. Moral da história: chequem o cabo do freio de mão com mais frequência, pessoal.",Negativo,Negativo,Neutro
95,i1s2gdd,"O que me dá raiva é o Reginaldo Leme. Respeito a carreira do cara, mas já tá cansativo ele. Só jogando umas estatísticas aleatórias e dados inúteis, quase sem nenhum insight.",Negativo,Negativo,Negativo
96,i1x2e2y,É a vizinha do 3o. andar,Neutro,Neutro,Neutro
97,i22rgoh,Estamos aí!,Positivo,Positivo,Positivo
